Nom du film,Annee,Score,Duree,Acteur,Genre,Description,Public,Pays
The Secret in Their Eyes,2009,8.2,"2,h, ,9,m","Ricardo Darín,Soledad Villamil,Pablo Rago,Carla Quevedo,Javier Godino,Bárbara Palladino,Rudy Romano,Alejandro Abelenda,Mario Alarcón,Guillermo Francella,Sebastián Blanco,Mariano Argento,José Luis Gioia,Juan José Ortíz,Kiko Cerone,Fernando Pardo,Maximiliano Trento,Sergio Santana","Drama,Mystery,Romance,Back to top",A retired legal counselor writes a novel hoping to find closure for one of his past unresolved homicide cases and for his unreciprocated love with his superior - both of which still haunt him decades later.,R,Argentina
Inside Out,2015,8.2,"1,h, ,35,m","Amy Poehler,Bill Hader,Lewis Black,Mindy Kaling,Phyllis Smith,Richard Kind,Kaitlyn Dias,Diane Lane,Kyle MacLachlan,Paula Poundstone,Bobby Moynihan,Paula Pell,Dave Goelz,Frank Oz,Josh Cooley,Flea,John Ratzenberger,Carlos Alazraqui","Animation,Adventure,Comedy,Back to top","After young Riley is uprooted from her Midwest life and moved to San Francisco, her emotions - Joy, Fear, Anger, Disgust and Sadness - conflict on how best to navigate a new city, house, and school.",PG,United States
V for Vendetta,2005,8.2,"2,h, ,12,m","Hugo Weaving,Natalie Portman,Rupert Graves,Stephen Rea,Stephen Fry,John Hurt,Tim Pigott-Smith,Roger Allam,Ben Miles,Sinéad Cusack,Natasha Wightman,John Standing,Eddie Marsan,Clive Ashborn,Emma Field-Rayner,Ian Burfield,Mark Phoenix,Alister Mazzotti","Action,Drama,Sci-Fi,Back to top","In a future British dystopian society, a shadowy freedom fighter, known only by the alias of ""V"", plots to overthrow the tyrannical government - with the help of a young woman.",R,United States
Dial M for Murder,1954,8.2,"1,h, ,45,m","Ray Milland,Grace Kelly,Robert Cummings,John Williams,Anthony Dawson,Leo Britt,Patrick Allen,George Leigh,George Alderson,Robin Hughes,Richard Bender,Robin Sanders Clark,Jack Cunningham,Robert Dobson,Guy Doleman,Bess Flowers,Robert Garvin,Herschel Graham","Crime,Thriller,Back to top",A former tennis star arranges the murder of his adulterous wife.,PG,United States
Raging Bull,1980,8.2,"2,h, ,9,m","Robert De Niro,Cathy Moriarty,Joe Pesci,Frank Vincent,Nicholas Colasanto,Theresa Saldana,Mario Gallo,Frank Adonis,Joseph Bono,Frank Topham,Lori Anne Flax,Charles Scorsese,Don Dunphy,Bill Hanrahan,Rita Bennett,James V. Christy,Bernie Allen,Floyd Anderson","Biography,Drama,Sport,Back to top","The life of boxer Jake LaMotta, whose violence and temper that led him to the top in the ring destroyed his life outside of it.",R,United States
"Lock, Stock and Two Smoking Barrels",1998,8.2,"1,h, ,47,m","Jason Flemyng,Dexter Fletcher,Nick Moran,Jason Statham,Steven Mackintosh,Nicholas Rowe,Nick Marcq,Charles Forbes,Vinnie Jones,Lenny McLean,Peter McNicholl,P.H. Moriarty,Frank Harper,Steve Sweeney,Huggy Leaver,Ronnie Fox,Tony McMahon,Stephen Marcus","Action,Comedy,Crime,Back to top","Eddy persuades his three pals to pool money for a vital poker game against a powerful local mobster, Hatchet Harry. Eddy loses, after which Harry gives him a week to pay back 500,000 pounds.",R,United Kingdom
Gone with the Wind,1939,8.2,"3,h, ,58,m","Clark Gable,Vivien Leigh,Thomas Mitchell,Barbara O'Neil,Evelyn Keyes,Ann Rutherford,George Reeves,Fred Crane,Hattie McDaniel,Oscar Polk,Butterfly McQueen,Victor Jory,Everett Brown,Howard Hickman,Alicia Rhett,Leslie Howard,Olivia de Havilland,Rand Brooks","Drama,Romance,War,Back to top",The manipulative daughter of a Georgia plantation owner conducts a turbulent romance with a roguish profiteer during the American Civil War and Reconstruction periods.,Passed,United States
The Elephant Man,1980,8.2,"2,h, ,4,m","Anthony Hopkins,John Hurt,Anne Bancroft,John Gielgud,Wendy Hiller,Freddie Jones,Michael Elphick,Hannah Gordon,Helen Ryan,John Standing,Dexter Fletcher,Lesley Dunlop,Phoebe Nicholls,Pat Gorman,Claire Davenport,Orla Pederson,Patsy Smart,Frederick Treves","Biography,Drama,Back to top","A Victorian surgeon rescues a heavily disfigured man who is mistreated while scraping a living as a side-show freak. Behind his monstrous façade, there is revealed a person of kindness, intelligence and sophistication.",PG,United States
No Country for Old Men,2007,8.2,"2,h, ,2,m","Tommy Lee Jones,Javier Bardem,Josh Brolin,Woody Harrelson,Kelly Macdonald,Garret Dillahunt,Tess Harper,Barry Corbin,Stephen Root,Rodger Boyce,Beth Grant,Ana Reeder,Kit Gwin,Zach Hopkins,Chip Love,Eduardo Antonio Garcia,Gene Jones,Myk Watford","Crime,Drama,Thriller,Back to top",Violence and mayhem ensue after a hunter stumbles upon a drug deal gone wrong and more than two million dollars in cash near the Rio Grande.,R,United States
The Thing,1982,8.2,"1,h, ,49,m","Kurt Russell,Wilford Brimley,Keith David,Richard Masur,T.K. Carter,David Clennon,Richard Dysart,Charles Hallahan,Peter Maloney,Donald Moffat,Joel Polis,Thomas G. Waites,Norbert Weisser,Larry Franco,Nate Irwin,William Zeman,Adrienne Barbeau,John Carpenter","Horror,Mystery,Sci-Fi,Back to top",A research team in Antarctica is hunted by a shape-shifting alien that assumes the appearance of its victims.,R,United States
Chinatown,1974,8.2,"2,h, ,10,m","Jack Nicholson,Faye Dunaway,John Huston,Perry Lopez,John Hillerman,Darrell Zwerling,Diane Ladd,Roy Jenson,Roman Polanski,Richard Bakalyan,Joe Mantell,Bruce Glover,Nandu Hinds,James O'Rear,James Hong,Beulah Quo,Jerry Fujikawa,Belinda Palmer","Drama,Mystery,Thriller,Back to top","A private detective hired to expose an adulterer in 1930s Los Angeles finds himself caught up in a web of deceit, corruption, and murder.",R,United States
The Great Escape,1963,8.2,"2,h, ,52,m","Steve McQueen,James Garner,Richard Attenborough,Charles Bronson,James Donald,Donald Pleasence,James Coburn,Hannes Messemer,David McCallum,Gordon Jackson,John Leyton,Angus Lennie,Nigel Stock,Robert Graf,Jud Taylor,Hans Reiser,Harry Riebauer,William Russell","Adventure,Drama,History,Back to top",Allied prisoners of war plan for several hundred of their number to escape from a German camp during World War II.,Approved,United States
Rashomon,1950,8.2,"1,h, ,28,m","Toshirô Mifune,Machiko Kyô,Masayuki Mori,Takashi Shimura,Minoru Chiaki,Kichijirô Ueda,Noriko Honma,Daisuke Katô","Crime,Drama,Mystery,Back to top","The rape of a bride and the murder of her samurai husband are recalled from the perspectives of a bandit, the bride, the samurai's ghost and a woodcutter.",Not Rated,Japan
Finding Nemo,2003,8.2,"1,h, ,40,m","Albert Brooks,Ellen DeGeneres,Alexander Gould,Willem Dafoe,Brad Garrett,Allison Janney,Austin Pendleton,Stephen Root,Vicki Lewis,Joe Ranft,Geoffrey Rush,Andrew Stanton,Elizabeth Perkins,Nicholas Bird,Bob Peterson,Barry Humphries,Eric Bana,Bruce Spence","Animation,Adventure,Comedy,Back to top","After his son is captured in the Great Barrier Reef and taken to Sydney, a timid clownfish sets out on a journey to bring him home.",G,United States
Jurassic Park,1993,8.2,"2,h, ,7,m","Sam Neill,Laura Dern,Jeff Goldblum,Richard Attenborough,Bob Peck,Martin Ferrero,BD Wong,Joseph Mazzello,Ariana Richards,Samuel L. Jackson,Wayne Knight,Gerald R. Molen,Miguel Sandoval,Cameron Thor,Christopher John Fields,Whit Hertford,Dean Cundey,Jophery C. Brown","Action,Adventure,Sci-Fi,Back to top",A pragmatic paleontologist touring an almost complete theme park on an island in Central America is tasked with protecting a couple of kids after a power failure causes the park's cloned dinosaurs to run loose.,PG-13,United States
Monty Python and the Holy Grail,1975,8.2,"1,h, ,31,m","Graham Chapman,John Cleese,Eric Idle,Terry Gilliam,Terry Jones,Michael Palin,Connie Booth,Carol Cleveland,Neil Innes,Bee Duffell,John Young,Rita Davies,Avril Stewart,Sally Kinghorn,Mark Zycon,Elspeth Cameron,Mitsuko Forstater,Sandy Johnson","Adventure,Comedy,Fantasy,Back to top","King Arthur and his Knights of the Round Table embark on a surreal, low-budget search for the Holy Grail, encountering many, very silly obstacles.",PG,United Kingdom
Kill Bill: Vol. 1,2003,8.2,"1,h, ,51,m","Uma Thurman,David Carradine,Daryl Hannah,Michael Madsen,Lucy Liu,Vivica A. Fox,Julie Dreyfus,Chiaki Kuriyama,Shin'ichi Chiba,Chia-Hui Liu,Michael Parks,Michael Bowen,Jun Kunimura,Kenji Ôba,Yuki Kazamatsuri,James Parks,Sakichi Sato,Jonathan Loughran","Action,Crime,Drama,Back to top","After awakening from a four-year coma, a former assassin wreaks vengeance on the team of assassins who betrayed her.",R,United States
The Treasure of the Sierra Madre,1948,8.2,"2,h, ,6,m","Humphrey Bogart,Walter Huston,Tim Holt,Bruce Bennett,Barton MacLane,Alfonso Bedoya,Arturo Soto Rangel,Manuel Dondé,José Torvay,Margarito Luna,Robert Blake,Guillermo Calles,Roberto Cañedo,Spencer Chan,Jacqueline Dalya,Ralph Dunn,Ernesto Escoto,Pat Flaherty","Adventure,Drama,Western,Back to top",Two down-on-their-luck Americans searching for work in 1920s Mexico convince an old prospector to help them mine for gold in the Sierra Madre Mountains.,Passed,United States
Spider-Man: No Way Home,2021,8.3,"2,h, ,28,m","Tom Holland,Zendaya,Benedict Cumberbatch,Jacob Batalon,Jon Favreau,Jamie Foxx,Willem Dafoe,Alfred Molina,Benedict Wong,Tony Revolori,Marisa Tomei,Andrew Garfield,Tobey Maguire,Angourie Rice,Arian Moayed,Paula Newsome,Hannibal Buress,Martin Starr","Action,Adventure,Fantasy,Back to top","With Spider-Man's identity now revealed, Peter asks Doctor Strange for help. When a spell goes wrong, dangerous foes from other worlds start to appear, forcing Peter to discover what it truly means to be Spider-Man.",PG-13,United States
A Beautiful Mind,2001,8.2,"2,h, ,15,m","Russell Crowe,Ed Harris,Jennifer Connelly,Christopher Plummer,Paul Bettany,Adam Goldberg,Josh Lucas,Anthony Rapp,Jason Gray-Stanford,Judd Hirsch,Austin Pendleton,Vivien Cardone,Jillie Simon,Victor Steinbach,Tanya Clarke,Thomas F. Walsh,Jesse Doran,Kent Cassella","Biography,Drama,Back to top","After John Nash, a brilliant but asocial mathematician, accepts secret work in cryptography, his life takes a turn for the nightmarish.",PG-13,United States
The Truman Show,1998,8.2,"1,h, ,43,m","Jim Carrey,Ed Harris,Laura Linney,Noah Emmerich,Natascha McElhone,Holland Taylor,Brian Delate,Blair Slater,Peter Krause,Heidi Schanz,Ron Taylor,Don Taylor,Ted Raymond,Judy Clayton,Fritz Dominique,Angel Schmiedt,Nastassja Schmiedt,Muriel Moore","Comedy,Drama,Back to top",An insurance salesman discovers his whole life is actually a reality TV show.,PG,United States
The Sixth Sense,1999,8.2,"1,h, ,47,m","Bruce Willis,Haley Joel Osment,Toni Collette,Olivia Williams,Trevor Morgan,Donnie Wahlberg,Peter Anthony Tambakis,Jeffrey Zubernis,Bruce Norris,Glenn Fitzgerald,Greg Wood,Mischa Barton,Angelica Page,Lisa Summerour,Firdous Bamji,Samia Shoaib,Hayden Saunier,Janis Dardaris","Drama,Mystery,Thriller,Back to top","A frightened, withdrawn Philadelphia boy who communicates with spirits seeks the help of a disheartened child psychologist.",PG-13,United States
Yojimbo,1961,8.2,"1,h, ,50,m","Toshirô Mifune,Eijirô Tôno,Tatsuya Nakadai,Yôko Tsukasa,Isuzu Yamada,Daisuke Katô,Seizaburô Kawazu,Takashi Shimura,Hiroshi Tachikawa,Yôsuke Natsuki,Kamatari Fujiwara,Ikio Sawamura,Atsushi Watanabe,Susumu Fujita,Kyû Sazanka,Kô Nishimura,Takeshi Katô,Ichirô Nakatani","Action,Drama,Thriller,Back to top",A crafty ronin comes to a town divided by two criminal gangs and decides to play them against each other to free the town.,Not Rated,Japan
Unforgiven,1992,8.2,"2,h, ,10,m","Clint Eastwood,Gene Hackman,Morgan Freeman,Richard Harris,Jaimz Woolvett,Saul Rubinek,Frances Fisher,Anna Thomson,David Mucci,Rob Campbell,Anthony James,Tara Frederick,Beverley Elliott,Liisa Repo-Martell,Josie Smith,Shane Meier,Aline Levasseur,Cherrilene Cardinal","Drama,Western,Back to top","Retired Old West gunslinger William Munny reluctantly takes on one last job, with the help of his old partner Ned Logan and a young man, The ""Schofield Kid.""",R,United States
There Will Be Blood,2007,8.2,"2,h, ,38,m","Daniel Day-Lewis,Paul Dano,Ciarán Hinds,Martin Stringer,Matthew Braden Stringer,Jacob Stringer,Joseph Mussey,Barry Del Sherman,Harrison Taylor,Stockton Taylor,Paul F. Tompkins,Dillon Freasier,Kevin Breznahan,Jim Meskimen,Erica Sullivan,Randall Carver,Coco Leigh,Sydney McCallister","Drama,Back to top","A story of family, religion, hatred, oil and madness, focusing on a turn-of-the-century prospector in the early days of the business.",R,United States
Shutter Island,2010,8.2,"2,h, ,18,m","Leonardo DiCaprio,Emily Mortimer,Mark Ruffalo,Ben Kingsley,Max von Sydow,Michelle Williams,Patricia Clarkson,Jackie Earle Haley,Ted Levine,John Carroll Lynch,Elias Koteas,Robin Bartlett,Christopher Denham,Nellie Sciutto,Joseph Sikora,Curtiss Cook,Raymond Anthony Thomas,Joseph McKenna","Mystery,Thriller,Back to top","In 1954, a U.S. Marshal investigates the disappearance of a murderer who escaped from a hospital for the criminally insane.",R,United States
Pan's Labyrinth,2006,8.2,"1,h, ,58,m","Ivana Baquero,Ariadna Gil,Sergi López,Maribel Verdú,Doug Jones,Álex Angulo,Manolo Solo,César Vea,Roger Casamajor,Ivan Massagué,Gonzalo Uriarte,Eusebio Lázaro,Francisco Vidal,Juanjo Cucalón,Lina Mira,Mario Zorrilla,Sebastián Haro,Mila Espiga","Drama,Fantasy,War,Back to top","In the Falangist Spain of 1944, the bookish young stepdaughter of a sadistic army officer escapes into an eerie but captivating fantasy world.",R,Mexico
Casino,1995,8.2,"2,h, ,58,m","Robert De Niro,Sharon Stone,Joe Pesci,James Woods,Don Rickles,Alan King,Kevin Pollak,L.Q. Jones,Dick Smothers,Frank Vincent,John Bloom,Pasquale Cajano,Melissa Prophet,Bill Allison,Vinny Vella,Philip Suriano,Erika von Tagen,Frankie Avalon","Crime,Drama,Back to top","A tale of greed, deception, money, power, and murder occur between two best friends: a mafia enforcer and a casino executive compete against each other over a gambling empire, and over a fast-living and fast-loving socialite.",R,United States
Judgment at Nuremberg,1961,8.3,"2,h, ,59,m","Spencer Tracy,Burt Lancaster,Richard Widmark,Marlene Dietrich,Maximilian Schell,Judy Garland,Montgomery Clift,William Shatner,Werner Klemperer,Kenneth MacKenna,Torben Meyer,Joseph Bernard,Alan Baxter,Edward Binns,Virginia Christine,Otto Waldis,Karl Swenson,Martin Brandt","Drama,War,Back to top","In 1948, an American court in occupied Germany tries four Nazis judged for war crimes.",Approved,United States
The Wolf of Wall Street,2013,8.2,"3,h","Leonardo DiCaprio,Jonah Hill,Margot Robbie,Matthew McConaughey,Kyle Chandler,Rob Reiner,Jon Bernthal,Jon Favreau,Jean Dujardin,Joanna Lumley,Cristin Milioti,Christine Ebersole,Shea Whigham,Katarina Cas,P.J. Byrne,Kenneth Choi,Brian Sacca,Henry Zebrowski","Biography,Comedy,Crime,Back to top","Based on the true story of Jordan Belfort, from his rise to a wealthy stock-broker living the high life to his fall involving crime, corruption and the federal government.",R,United States
The Father,2020,8.2,"1,h, ,37,m","Anthony Hopkins,Olivia Colman,Mark Gatiss,Olivia Williams,Imogen Poots,Rufus Sewell,Ayesha Dharker,Roman Zeller,Adnan Kundi,Brian Rodger,Evie Wray","Drama,Mystery,Back to top","A man refuses all assistance from his daughter as he ages. As he tries to make sense of his changing circumstances, he begins to doubt his loved ones, his own mind and even the fabric of his reality.",PG-13,United Kingdom
Ran,1985,8.2,"2,h, ,42,m","Tatsuya Nakadai,Akira Terao,Jinpachi Nezu,Daisuke Ryû,Mieko Harada,Yoshiko Miyazaki,Hisashi Igawa,Pîtâ,Masayuki Yui,Kazuo Katô,Norio Matsui,Toshiya Ito,Kenji Kodama,Takashi Watanabe,Mansai Nomura,Takeshi Katô,Jun Tazaki,Hitoshi Ueki","Action,Drama,War,Back to top","In Medieval Japan, an elderly warlord retires, handing over his empire to his three sons. However, he vastly underestimates how the new-found power will corrupt them and cause them to turn on each other...and him.",R,Japan
Green Book,2018,8.2,"2,h, ,10,m","Viggo Mortensen,Mahershala Ali,Linda Cardellini,Sebastian Maniscalco,Dimiter D. Marinov,Mike Hatton,P.J. Byrne,Joe Cortese,Maggie Nixon,Von Lewis,Jon Sortland,Don Stark,Anthony Mangano,Paul Sloan,Quinn Duffy,Seth Hurwitz,Hudson Galloway,Gavin Lyle Foley","Biography,Comedy,Drama,Back to top",A working-class Italian-American bouncer becomes the driver for an African-American classical pianist on a tour of venues through the 1960s American South.,PG-13,United States
Some Like It Hot,1959,8.2,"2,h, ,1,m","Marilyn Monroe,Tony Curtis,Jack Lemmon,George Raft,Pat O'Brien,Joe E. Brown,Nehemiah Persoff,Joan Shawlee,Billy Gray,George E. Stone,Dave Barry,Mike Mazurki,Harry Wilson,Beverly Wills,Barbara Drew,Edward G. Robinson Jr.,Sam Bagley,Brandon Beach","Comedy,Music,Romance,Back to top","After two male musicians witness a mob hit, they flee the state in an all-female band disguised as women, but further complications set in.",Passed,United States
The Kid,1921,8.3,"1,h, ,8,m","Charles Chaplin,Edna Purviance,Jackie Coogan,Carl Miller,Albert Austin,Beulah Bains,Nellie Bly Baker,Henry Bergman,Edward Biby,B.F. Blinn,Kitty Bradbury,Frank Campeau,Bliss Chevalier,Frances Cochran,Elsie Codd,Jack Coogan Sr.,Estelle Cook,Lillian Crane","Comedy,Drama,Family,Back to top","The Tramp cares for an abandoned child, but events put their relationship in jeopardy.",Passed,United States
All About Eve,1950,8.2,"2,h, ,18,m","Bette Davis,Anne Baxter,George Sanders,Celeste Holm,Gary Merrill,Hugh Marlowe,Gregory Ratoff,Barbara Bates,Marilyn Monroe,Thelma Ritter,Walter Hampden,Randy Stuart,Craig Hill,Leland Harris,Barbara White,Eddie Fisher,William Pullen,Claude Stroud","Drama,Back to top",A seemingly timid but secretly ruthless ingénue insinuates herself into the lives of an aging Broadway star and her circle of theater friends.,Passed,United States
Downfall,2004,8.2,"2,h, ,36,m","Bruno Ganz,Alexandra Maria Lara,Ulrich Matthes,Juliane Köhler,Corinna Harfouch,Heino Ferch,Christian Berkel,Matthias Habich,Thomas Kretschmann,Michael Mendl,André Hennicke,Ulrich Noethen,Birgit Minichmayr,Rolf Kanies,Justus von Dohnányi,Dieter Mann,Christian Redl,Götz Otto","Biography,Drama,History,Back to top","Traudl Junge, the final secretary for Adolf Hitler, tells of the Nazi dictator's final days in his Berlin bunker at the end of WWII.",R,Germany
For a Few Dollars More,1965,8.2,"2,h, ,12,m","Clint Eastwood,Lee Van Cleef,Gian Maria Volontè,Mara Krupp,Luigi Pistilli,Klaus Kinski,Luis Rodríguez,Benito Stefanelli,Panos Papadopulos,Aldo Sambrell,Roberto Camardiel,Joseph Egger,Tomás Blanco,Lorenzo Robledo,Dante Maggio,Sergio Mendizábal,Diana Rabito,Giovanni Tarallo","Western,Back to top",Two bounty hunters with the same intentions team up to track down an escaped Mexican outlaw.,R,Italy
Batman Begins,2005,8.2,"2,h, ,20,m","Christian Bale,Michael Caine,Ken Watanabe,Liam Neeson,Katie Holmes,Gary Oldman,Cillian Murphy,Tom Wilkinson,Rutger Hauer,Mark Boone Junior,Linus Roache,Morgan Freeman,Larry Holden,Gerard Murphy,Colin McFarlane,Sara Stewart,Gus Lewis,Richard Brake","Action,Crime,Drama,Back to top","After training with his mentor, Batman begins his fight to free crime-ridden Gotham City from corruption.",PG-13,United States
Dangal,2016,8.3,"2,h, ,41,m","Aamir Khan,Sakshi Tanwar,Fatima Sana Shaikh,Sanya Malhotra,Aparshakti Khurana,Zaira Wasim,Suhani Bhatnagar,Ritvik Sahore,Girish Kulkarni,Ravi Aneja,Anurag Arora,Mahesh Balraj,Vivan Bhatena,Anmol Charan,Karamveer Choudhary,Ishika Gagneja,Badrul Islam,Jagbir","Action,Biography,Drama,Back to top",Former wrestler Mahavir Singh Phogat and his two wrestler daughters struggle towards glory at the Commonwealth Games in the face of societal oppression.,Not Rated,India
1917,2019,8.2,"1,h, ,59,m","Dean-Charles Chapman,George MacKay,Daniel Mays,Colin Firth,Pip Carter,Andy Apollo,Paul Tinto,Josef Davies,Billy Postlethwaite,Gabriel Akuwudike,Andrew Scott,Spike Leighton,Robert Maaser,Gerran Howell,Adam Hugill,Mark Strong,Richard McCabe,Benjamin Adams","Action,Drama,War,Back to top","April 6th, 1917. As an infantry battalion assembles to wage war deep in enemy territory, two soldiers are assigned to race against time and deliver a message that will stop 1,600 men from walking straight into a deadly trap.",R,United Kingdom
Like Stars on Earth,2007,8.4,"2,h, ,45,m","Darsheel Safary,Aamir Khan,Tisca Chopra,Vipin Sharma,Sachet Engineer,Tanay Chheda,Lalitha Lajmi,Girija Oak,Ravi Khanvilkar,Pratima Kulkarni,Meghna Malik,Sonali Sachdev,Sanjay Dadhich,Rajgopal Iyer,Bugs Bhargava Krishna,Shankar Sachdev,M.K. Raina,Gurkirtan","Drama,Family,Back to top","An eight-year-old boy is thought to be a lazy trouble-maker, until the new art teacher has the patience and compassion to discover the real problem behind his struggles in school.",PG,India
Indiana Jones and the Last Crusade,1989,8.2,"2,h, ,7,m","Harrison Ford,Sean Connery,Alison Doody,Denholm Elliott,John Rhys-Davies,Julian Glover,River Phoenix,Michael Byrne,Kevork Malikyan,Robert Eddison,Richard Young,Alexei Sayle,Alex Hyde-White,Paul Maxwell,Isla Blair,Vernon Dobtcheff,J.J. Hardy,Bradley Gregg","Action,Adventure,Back to top","In 1938, after his father Professor Henry Jones, Sr. goes missing while pursuing the Holy Grail, Professor Henry ""Indiana"" Jones, Jr. finds himself up against Adolf Hitler's Nazis again to stop them from obtaining its powers.",PG-13,United States
Bicycle Thieves,1948,8.3,"1,h, ,29,m","Lamberto Maggiorani,Enzo Staiola,Lianella Carell,Elena Altieri,Gino Saltamerenda,Giulio Chiari,Vittorio Antonucci,Michele Sakara,Fausto Guerzoni,Emma Druetti,Carlo Jachino,Giulio Battiferri,Ida Bracci Dorati,Nando Bruno,Eolo Capritti,Memmo Carotenuto,Giovanni Corporale,Veriano Ginesi","Drama,Back to top","In post-war Italy, a working-class man's bicycle is stolen, endangering his efforts to find work. He and his son set out to find it.",Not Rated,Italy
Snatch,2000,8.2,"1,h, ,42,m","Jason Statham,Brad Pitt,Stephen Graham,Vinnie Jones,Ade,William Beck,Andy Beckwith,Ewen Bremner,Jason Buckham,Mickey Cantwell,Nicola Collins,Teena Collins,Charles Cork,James Cunningham,Sorcha Cusack,Mickey Dee,Benicio Del Toro,Sam Douglas","Comedy,Crime,Back to top","Unscrupulous boxing promoters, violent bookmakers, a Russian gangster, incompetent amateur robbers and supposedly Jewish jewelers fight to track down a priceless stolen diamond.",R,United Kingdom
Die Hard,1988,8.2,"2,h, ,12,m","Bruce Willis,Alan Rickman,Bonnie Bedelia,Reginald VelJohnson,Paul Gleason,De'voreaux White,William Atherton,Hart Bochner,James Shigeta,Alexander Godunov,Bruno Doyon,Andreas Wisniewski,Clarence Gilyard Jr.,Joseph Plewa,Lorenzo Caccialanza,Gérard Bonn,Dennis Hayden,Al Leong","Action,Thriller,Back to top",A New York City police officer tries to save his estranged wife and several others taken hostage by terrorists during a Christmas party at the Nakatomi Plaza in Los Angeles.,R,United States
L.A. Confidential,1997,8.2,"2,h, ,18,m","Kevin Spacey,Russell Crowe,Guy Pearce,Kim Basinger,James Cromwell,Danny DeVito,David Strathairn,Ron Rifkin,Matt McCoy,Paul Guilfoyle,Paolo Seganti,Elisabeth Granli,Sandra Taylor,Steve Rankin,Graham Beckel,Allan Graf,Precious Chong,Symba","Crime,Drama,Mystery,Back to top","As corruption grows in 1950s Los Angeles, three policemen - one strait-laced, one brutal, and one sleazy - investigate a series of murders with their own brand of justice.",R,United States
Metropolis,1927,8.3,"2,h, ,33,m","Brigitte Helm,Alfred Abel,Gustav Fröhlich,Rudolf Klein-Rogge,Fritz Rasp,Theodor Loos,Erwin Biswanger,Heinrich George,Fritz Alberti,Grete Berger,Olly Boeheim,Max Dietze,Ellen Frey,Beatrice Garga,Heinrich Gotho,Dolly Grey,Anny Hintze,Gottfried Huppertz","Drama,Sci-Fi,Back to top","In a futuristic city sharply divided between the working class and the city planners, the son of the city's mastermind falls in love with a working-class prophet who predicts the coming of a savior to mediate their differences.",Not Rated,Germany
Taxi Driver,1976,8.2,"1,h, ,54,m","Robert De Niro,Jodie Foster,Cybill Shepherd,Albert Brooks,Diahnne Abbott,Frank Adu,Victor Argo,Gino Ardito,Garth Avery,Peter Boyle,Harry Cohn,Copper Cunningham,Brenda Dickson,Harry Fischler,Nat Grant,Leonard Harris,Richard Higgs,Beau Kayser","Crime,Drama,Back to top","A mentally unstable veteran works as a nighttime taxi driver in New York City, where the perceived decadence and sleaze fuels his urge for violent action.",R,United States
Up,2009,8.3,"1,h, ,36,m","Edward Asner,Jordan Nagai,John Ratzenberger,Christopher Plummer,Bob Peterson,Delroy Lindo,Jerome Ranft,David Kaye,Elie Docter,Jeremy Leary,Mickie McGowan,Danny Mann,Donald Fullilove,Jess Harnell,Josh Cooley,Pete Docter,Mark Andrews,Bob Bergen","Animation,Adventure,Comedy,Back to top","78-year-old Carl Fredricksen travels to Paradise Falls in his house equipped with balloons, inadvertently taking a young stowaway.",PG,United States
Heat,1995,8.3,"2,h, ,50,m","Al Pacino,Robert De Niro,Val Kilmer,Jon Voight,Tom Sizemore,Diane Venora,Amy Brenneman,Ashley Judd,Mykelti Williamson,Wes Studi,Ted Levine,Dennis Haysbert,William Fichtner,Natalie Portman,Tom Noonan,Kevin Gage,Hank Azaria,Susan Traylor","Action,Crime,Drama,Back to top",A group of high-end professional thieves start to feel the heat from the LAPD when they unknowingly leave a clue at their latest heist.,R,United States
Incendies,2010,8.3,"2,h, ,11,m","Lubna Azabal,Mélissa Désormeaux-Poulin,Maxim Gaudette,Mustafa Kamel,Hussein Sami,Rémy Girard,Dominique Briand,Frédéric Paquet,Hamed Najem,Ahmad Massad,Bader Alami,Majida Hussein,Asriah Nijres,John Dunn-Hill,Nadia Essadiqi,Chaouki Charbel,Axel Garbi,Amine Benzenine","Drama,Mystery,Back to top",Twins journey to the Middle East to discover their family history and fulfill their mother's last wishes.,R,Canada
