Nom du film,Annee,Score,Duree,Acteur,Genre,Description,Public,Pays
Platoon,1986,8.1,"2,h","Charlie Sheen,Tom Berenger,Willem Dafoe,Keith David,Forest Whitaker,Francesco Quinn,Kevin Dillon,John C. McGinley,Reggie Johnson,Mark Moses,Corey Glover,Johnny Depp,Chris Pedersen,Bob Orwig,Corkey Ford,David Neidorf,Richard Edson,Tony Todd","Drama,War,Back to top","Chris Taylor, a neophyte recruit in Vietnam, finds himself caught in a battle of wills between two sergeants, one good and the other evil. A shrewd examination of the brutality of war and the duality of man in conflict.",R,United States
Ratatouille,2007,8.1,"1,h, ,51,m","Brad Garrett,Lou Romano,Patton Oswalt,Ian Holm,Brian Dennehy,Peter Sohn,Peter O'Toole,Janeane Garofalo,Will Arnett,Julius Callahan,James Remar,John Ratzenberger,Teddy Newton,Tony Fucile,Jake Steinfeld,Brad Bird,Stéphane Roux,Jack Bird","Animation,Adventure,Comedy,Back to top",A rat who can cook makes an unusual alliance with a young kitchen worker at a famous Paris restaurant.,G,United States
Ford v Ferrari,2019,8.1,"2,h, ,32,m","Matt Damon,Christian Bale,Jon Bernthal,Caitríona Balfe,Josh Lucas,Noah Jupe,Tracy Letts,Remo Girone,Ray McKinnon,JJ Feild,Jack McMullen,Corrado Invernizzi,Joe Williamson,Ian Harding,Christopher Darga,Shawn Law,Emil Beheshti,Darrin Prescott","Action,Biography,Drama,Back to top",American car designer Carroll Shelby and driver Ken Miles battle corporate interference and the laws of physics to build a revolutionary race car for Ford in order to defeat Ferrari at the 24 Hours of Le Mans in 1966.,PG-13,United States
Rocky,1976,8.1,"2,h","Sylvester Stallone,Talia Shire,Burt Young,Carl Weathers,Burgess Meredith,Thayer David,Joe Spinell,Jimmy Gambina,Bill Baldwin,Al Silvani,George Memmoli,Jodi Letizia,Diana Lewis,George O'Hanlon,Larry Carroll,Stan Shaw,Don Sherman,Billy Sands","Drama,Sport,Back to top",A small-time Philadelphia boxer gets a supremely rare chance to fight the world heavyweight champion in a bout in which he strives to go the distance for his self-respect.,PG,United States
Tokyo Story,1953,8.2,"2,h, ,16,m","Chishû Ryû,Chieko Higashiyama,Sô Yamamura,Setsuko Hara,Haruko Sugimura,Kuniko Miyake,Kyôko Kagawa,Eijirô Tôno,Nobuo Nakamura,Shirô Ôsaka,Hisao Toake,Teruko Nagaoka,Mutsuko Sakura,Toyo Takahashi,Tôru Abe,Sachiko Mitani,Zen Murase,Mitsuhiro Môri","Drama,Back to top","An old couple visit their children and grandchildren in the city, but receive little attention.",Not Rated,Japan
Hotel Rwanda,2004,8.1,"2,h, ,1,m","Don Cheadle,Sophie Okonedo,Joaquin Phoenix,Xolani Mali,Desmond Dube,Hakeem Kae-Kazim,Tony Kgoroge,Rosie Motene,Neil McCarthy,Mabutho 'Kid' Sithole,Nick Nolte,Fana Mokoena,Jeremiah Ndlovu,Lebo Mashile,Antonio David Lyons,Leleti Khumalo,Kgomotso Seitshohlo,Lerato Mokgotho","Biography,Drama,History,Back to top","Paul Rusesabagina, a hotel manager, houses over a thousand Tutsi refugees during their struggle against the Hutu militia in Rwanda, Africa.",PG-13,United Kingdom
Dead Poets Society,1989,8.1,"2,h, ,8,m","Robin Williams,Robert Sean Leonard,Ethan Hawke,Josh Charles,Gale Hansen,Dylan Kussman,Allelon Ruggiero,James Waterston,Norman Lloyd,Kurtwood Smith,Carla Belver,Leon Pownall,George Martin,Joe Aufiery,Matt Carey,Kevin Cooney,Jane Moore,Lara Flynn Boyle","Comedy,Drama,Back to top",Maverick teacher John Keating uses poetry to embolden his boarding school students to new heights of self-expression.,PG,United States
The Passion of Joan of Arc,1928,8.2,"1,h, ,54,m","Maria Falconetti,Eugene Silvain,André Berley,Maurice Schutz,Antonin Artaud,Michel Simon,Jean d'Yd,Louis Ravet,Armand Lurville,Jacques Arnna,Alexandre Mihalesco,Léon Larive,Jean Aymé,Camille Bardou,Gilbert Dacheux,Gilbert Dalleu,Paul Delauzac,Dimitri Dimitriev","Biography,Drama,History,Back to top","In 1431, Jeanne d'Arc is placed on trial on charges of heresy. The ecclesiastical jurists attempt to force Jeanne to recant her claims of holy visions.",Passed,France
Jaws,1975,8.1,"2,h, ,4,m","Roy Scheider,Robert Shaw,Richard Dreyfuss,Lorraine Gary,Murray Hamilton,Carl Gottlieb,Jeffrey Kramer,Susan Backlinie,Jonathan Filley,Ted Grossman,Chris Rebello,Jay Mello,Lee Fierro,Jeffrey Voorhees,Craig Kingsbury,Robert Nevin,Peter Benchley,Jonathan Searle","Adventure,Thriller,Back to top","When a killer shark unleashes chaos on a beach community off Cape Cod, it's up to a local sheriff, a marine biologist, and an old seafarer to hunt the beast down.",PG,United States
The Big Lebowski,1998,8.1,"1,h, ,57,m","Jeff Bridges,John Goodman,Julianne Moore,Steve Buscemi,David Huddleston,Philip Seymour Hoffman,Tara Reid,Philip Moon,Mark Pellegrino,Peter Stormare,Flea,Torsten Voges,Jimmie Dale Gilmore,Jack Kehler,John Turturro,James G. Hoosier,Carlos Leon,Terrence Burton","Comedy,Crime,Back to top","Ultimate L.A. slacker Jeff ""The Dude"" Lebowski, mistaken for a millionaire of the same name, seeks restitution for a rug ruined by debt collectors, enlisting his bowling buddies for help while trying to find the millionaire's missing wife.",R,United States
Mary and Max,2009,8.1,"1,h, ,32,m","Toni Collette,Philip Seymour Hoffman,Eric Bana,Barry Humphries,Christopher Massey,Oliver Marks,Daisy Kocher,Daniel Marks,Hamish Hughes,Dan Doherty,Julie Forsyth,Mandy Mao,Patrick McCabe,Adam Elliot,Mr. Peck,Michael James Allen,Bill Murphy,Shaun Patten","Animation,Comedy,Drama,Back to top","A tale of friendship between two unlikely pen pals: Mary, a lonely, eight-year-old girl living in the suburbs of Melbourne, and Max, a forty-four-year old, severely obese man living in New York.",Not Rated,Australia
How to Train Your Dragon,2010,8.1,"1,h, ,38,m","Jay Baruchel,Gerard Butler,Christopher Mintz-Plasse,Craig Ferguson,America Ferrera,Jonah Hill,T.J. Miller,Kristen Wiig,Robin Atkin Downes,Philip McGrade,Kieron Elliott,Ashley Jensen,David Tennant,Thom Adcox-Hernandez,Tony Anselmo,Bob Bouchard,Nicholas Guest,Kelly Nigh","Animation,Action,Adventure,Back to top","A hapless young Viking who aspires to hunt dragons becomes the unlikely friend of a young dragon himself, and learns there may be more to the creatures than he assumed.",PG,United States
"Monsters, Inc.",2001,8.1,"1,h, ,32,m","Billy Crystal,John Goodman,Mary Gibbs,Steve Buscemi,James Coburn,Jennifer Tilly,Bob Peterson,John Ratzenberger,Frank Oz,Daniel Gerson,Steve Susskind,Bonnie Hunt,Jeff Pidgeon,Samuel Lord Black,Jack Angel,Bob Bergen,Rodger Bumpass,Gino Conforti","Animation,Adventure,Comedy,Back to top","In order to power the city, monsters have to scare children so that they scream. However, the children are toxic to the monsters, and after a child gets through, two monsters realize things may not be what they think.",G,United States
Mad Max: Fury Road,2015,8.1,"2,h","Tom Hardy,Charlize Theron,Nicholas Hoult,Zoë Kravitz,Hugh Keays-Byrne,Josh Helman,Nathan Jones,Rosie Huntington-Whiteley,Riley Keough,Abbey Lee,Courtney Eaton,John Howard,Richard Carter,Iota,Angus Sampson,Jennifer Hagan,Megan Gale,Melissa Jaffer","Action,Adventure,Sci-Fi,Back to top","In a post-apocalyptic wasteland, a woman rebels against a tyrannical ruler in search for her homeland with the aid of a group of female prisoners, a psychotic worshiper, and a drifter named Max.",R,Australia
Room,2015,8.1,"1,h, ,58,m","Brie Larson,Jacob Tremblay,Sean Bridgers,Wendy Crewson,Sandy McMaster,Matt Gordon,Amanda Brugel,Joe Pingue,Joan Allen,Zarrin Darnell-Martin,Cas Anvar,William H. Macy,Jee-Yun Lee,Randal Edwards,Justin Mader,Ola Sturik,Rodrigo Fernandez-Stoll,Rory O'Shea","Drama,Thriller,Back to top","Held captive for 7 years in an enclosed space, a woman and her young son finally gain their freedom, allowing the boy to experience the outside world for the first time.",R,Ireland
Memories of Murder,2003,8.1,"2,h, ,12,m","Song Kang-ho,Kim Sang-kyung,Roe-ha Kim,Jae-ho Song,Byun Hee-Bong,Seo-hie Ko,Tae-ho Ryu,No-shik Park,Park Hae-il,Mi-seon Jeon,Young-hwa Seo,Woo Go-na,Ok-joo Lee,Jong-ryol Choi,Seung-mok Yoo,Hun-Kyung Lee,Shin Hyun-jong,Jae-eung Lee","Crime,Drama,Mystery,Back to top","In a small Korean province in 1986, two detectives struggle with the case of multiple young women being found raped and murdered by an unknown culprit.",Not Rated,South Korea
The Seventh Seal,1957,8.1,"1,h, ,36,m","Max von Sydow,Gunnar Björnstrand,Bengt Ekerot,Nils Poppe,Bibi Andersson,Inga Gill,Maud Hansson,Inga Landgré,Gunnel Lindblom,Bertil Anderberg,Anders Ek,Åke Fridell,Gunnar Olsson,Erik Strandmark,Siv Aleros,Sten Ardenstam,Harry Asklund,Benkt-Åke Benktsson","Drama,Fantasy,Back to top","A knight returning to Sweden after the Crusades seeks answers about life, death, and the existence of God as he plays chess against the Grim Reaper during the Black Plague.",Not Rated,Sweden
Wild Tales,2014,8.1,"2,h, ,2,m","Darío Grandinetti,María Marull,Mónica Villa,Diego Starosta,Marcelo Frasca,Lucila Mangone,María Laura Caccamo,Carlos Alberto Vavassori,Pablo Machado,Horacio Vay,Javier Pedersoli,Héctor Drachtman,María Rosa López Ottonello,Rita Cortese,Julieta Zylberberg,César Bordón,Juan Santiago Linari,Leonardo Sbaraglia","Comedy,Drama,Thriller,Back to top",Six short stories that explore the extremities of human behavior involving people in distress.,R,Argentina
Mr. Smith Goes to Washington,1939,8.1,"2,h, ,9,m","James Stewart,Jean Arthur,Claude Rains,Edward Arnold,Guy Kibbee,Thomas Mitchell,Eugene Pallette,Beulah Bondi,H.B. Warner,Harry Carey,Astrid Allwyn,Ruth Donnelly,Grant Mitchell,Porter Hall,H.V. Kaltenborn,Charles Lane,Pierre Watkin,Dick Elliott","Comedy,Drama,Back to top","A naive youth leader is appointed to fill a vacancy in the U.S. Senate. His idealistic plans promptly collide with corruption at home and subterfuge from his hero in Washington, but he tries to forge ahead despite attacks on his character.",Passed,United States
Sherlock Jr.,1924,8.2,"45,m","Buster Keaton,Kathryn McGuire,Joe Keaton,Erwin Connelly,Ward Crane,Jane Connelly,George Davis,Doris Deane,Christine Francis,Betsy Ann Hisle,Kewpie Morgan,Steve Murphy,John Patrick,Ford West","Action,Comedy,Romance,Back to top","A film projectionist longs to be a detective, and puts his meagre skills to work when he is framed by a rival for stealing his girlfriend's father's pocketwatch.",Passed,United States
Hacksaw Ridge,2016,8.1,"2,h, ,19,m","Andrew Garfield,Sam Worthington,Luke Bracey,Teresa Palmer,Richard Pyros,Jacob Warner,Milo Gibson,Darcy Bryce,Roman Guerriero,James Lugton,Kasia Stelmach,Hugo Weaving,Rachel Griffiths,Jarin Towney,Tim McGarry,Tyler Coppin,Richard Platt,Nathaniel Buzolic","Biography,Drama,History,Back to top","World War II American Army Medic Desmond T. Doss, who served during the Battle of Okinawa, refuses to kill people and becomes the first man in American history to receive the Medal of Honor without firing a shot.",R,Australia
Barry Lyndon,1975,8.1,"3,h, ,5,m","Ryan O'Neal,Marisa Berenson,Patrick Magee,Hardy Krüger,Steven Berkoff,Gay Hamilton,Marie Kean,Diana Körner,Murray Melvin,Frank Middlemass,André Morell,Arthur O'Sullivan,Godfrey Quigley,Leonard Rossiter,Philip Stone,Leon Vitali,John Bindon,Roger Booth","Adventure,Drama,War,Back to top",An Irish rogue wins the heart of a rich widow and assumes her dead husband's aristocratic position in 18th-century England.,PG,United Kingdom
Klaus,2019,8.1,"1,h, ,36,m","Jason Schwartzman,J.K. Simmons,Rashida Jones,Will Sasso,Neda Margrethe Labba,Sergio Pablos,Norm MacDonald,Joan Cusack,Evan Agos,Sky Alexis,Jaeden Bettencourt,Teddy Blum,Mila Brener,Sydney Brower,Finn Carr,Kendall Joy Hall,Hailey Hermida,Lexie Holland","Animation,Adventure,Comedy,Back to top","A simple act of kindness always sparks another, even in a frozen, faraway place. When Smeerensburg's new postman, Jesper, befriends toymaker Klaus, their gifts melt an age-old feud and deliver a sleigh full of holiday traditions.",PG,Spain
In the Name of the Father,1993,8.1,"2,h, ,13,m","Daniel Day-Lewis,Pete Postlethwaite,Alison Crosbie,Philip King,Emma Thompson,Nye Heron,Anthony Brophy,Frankie McCafferty,Paul Warriner,Julian Walsh,Stuart Wolfenden,Jo Connor,Karen Carlisle,Seamus Moran,Billy Byrne,Maureen McBride,Jane Nolan,Laurence Griffin","Biography,Crime,Drama,Back to top",A man's coerced confession to an I.R.A. bombing he did not commit results in the imprisonment of his father as well. An English lawyer fights to free them.,R,Ireland
The Deer Hunter,1978,8.1,"3,h, ,3,m","Robert De Niro,Christopher Walken,John Cazale,John Savage,Meryl Streep,George Dzundza,Chuck Aspegren,Shirley Stoler,Rutanya Alda,Pierre Segui,Mady Kaplan,Amy Wright,Mary Ann Haenel,Richard Kuss,Joe Grifasi,Christopher Colombi Jr.,Victoria Karnafel,Jack Scardino","Drama,War,Back to top",An in-depth examination of the ways in which the Vietnam War impacts and disrupts the lives of several friends in a small steel mill town in Pennsylvania.,R,United States
The Wages of Fear,1953,8.2,"2,h, ,11,m","Yves Montand,Charles Vanel,Peter van Eyck,Folco Lulli,Véra Clouzot,William Tubbs,Darío Moreno,Jo Dest,Antonio Centa,Luis De Lima,Grégoire Gromoff,Josep Palau i Fabre,Faustini,Seguna,Darling Légitimus,René Baranger,Pat Hurst,Evelio Larenagas","Adventure,Drama,Thriller,Back to top","In a decrepit South American village, four men are hired to transport an urgent nitroglycerine shipment without the equipment that would make it safe.",Not Rated,France
The Grand Budapest Hotel,2014,8.1,"1,h, ,39,m","Ralph Fiennes,F. Murray Abraham,Mathieu Amalric,Adrien Brody,Willem Dafoe,Jeff Goldblum,Harvey Keitel,Jude Law,Bill Murray,Edward Norton,Saoirse Ronan,Jason Schwartzman,Léa Seydoux,Tilda Swinton,Tom Wilkinson,Owen Wilson,Tony Revolori,Larry Pine","Adventure,Comedy,Crime,Back to top","A writer encounters the owner of an aging high-class hotel, who tells him of his early years serving as a lobby boy in the hotel's glorious years under an exceptional concierge.",R,United States
The General,1926,8.2,"1,h, ,7,m","Buster Keaton,Marion Mack,Glen Cavender,Jim Farley,Frederick Vroom,Frank Barnes,Charles Henry Smith,Joe Keaton,Mike Donlin,Tom Nawn,Henry Baird,Joe Bricher,Jimmy Bryant,Sergeant Bukowski,C.C. Cruson,Jack Dempster,Keith Fennell,Budd Fine","Action,Adventure,Comedy,Back to top","After being rejected by the Confederate military, not realizing it was due to his crucial civilian role, an engineer must single-handedly recapture his beloved locomotive after it is seized by Union spies and return it through enemy lines.",Passed,United States
The Third Man,1949,8.1,"1,h, ,33,m","Orson Welles,Joseph Cotten,Alida Valli,Trevor Howard,Paul Hörbiger,Ernst Deutsch,Erich Ponto,Siegfried Breuer,Hedwig Bleibtreu,Bernard Lee,Wilfrid Hyde-White,Nelly Arno,Jack Arrow,Harold Ayer,Harry Belcher,Leo Bieber,Paul Birch,Martin Boddey","Film-Noir,Mystery,Thriller,Back to top","Pulp novelist Holly Martins travels to shadowy, postwar Vienna, only to find himself investigating the mysterious death of an old friend, Harry Lime.",Approved,United Kingdom
Ben-Hur,1959,8.1,"3,h, ,32,m","Charlton Heston,Jack Hawkins,Stephen Boyd,Haya Harareet,Hugh Griffith,Martha Scott,Cathy O'Donnell,Sam Jaffe,Finlay Currie,Frank Thring,Terence Longdon,George Relph,André Morell,Nello Appodia,Fortunato Arena,Bruno Ariè,Les Ballets Africains,Emma Baron","Adventure,Drama,Back to top","After a Jewish prince is betrayed and sent into slavery by a Roman friend in 1st-century Jerusalem, he regains his freedom and comes back for revenge.",G,United States
Gone Girl,2014,8.1,"2,h, ,29,m","Ben Affleck,Rosamund Pike,Neil Patrick Harris,Tyler Perry,Carrie Coon,Kim Dickens,Patrick Fugit,David Clennon,Lisa Banes,Missi Pyle,Emily Ratajkowski,Casey Wilson,Lola Kirke,Boyd Holbrook,Sela Ward,Lee Norris,Jamie McShane,Leonard Kelly-Young","Drama,Mystery,Thriller,Back to top","With his wife's disappearance having become the focus of an intense media circus, a man sees the spotlight turned on him when it's suspected that he may not be innocent.",R,United States
Harry Potter and the Deathly Hallows: Part 2,2011,8.1,"2,h, ,10,m","Daniel Radcliffe,Emma Watson,Rupert Grint,Michael Gambon,Ralph Fiennes,Alan Rickman,Evanna Lynch,Domhnall Gleeson,Clémence Poésy,Warwick Davis,John Hurt,Helena Bonham Carter,Graham Duff,Anthony Allgood,Rusty Goffe,Jon Key,Kelly Macdonald,Jason Isaacs","Adventure,Family,Fantasy,Back to top","Harry, Ron, and Hermione search for Voldemort's remaining Horcruxes in their effort to destroy the Dark Lord as the final battle rages on at Hogwarts.",PG-13,United Kingdom
Wild Strawberries,1957,8.1,"1,h, ,31,m","Victor Sjöström,Bibi Andersson,Ingrid Thulin,Gunnar Björnstrand,Jullan Kindahl,Folke Sundquist,Björn Bjelfvenstam,Naima Wifstrand,Gunnel Broström,Gertrud Fridh,Sif Ruud,Gunnar Sjöberg,Max von Sydow,Åke Fridell,Yngve Nordwall,Per Sjöstrand,Gio Petré,Gunnel Lindblom","Drama,Romance,Back to top","After living a life marked by coldness, an aging professor is forced to confront the emptiness of his existence.",Not Rated,Sweden
12 Years a Slave,2013,8.1,"2,h, ,14,m","Chiwetel Ejiofor,Michael Kenneth Williams,Michael Fassbender,Brad Pitt,Dwight Henry,Dickie Gravois,Bryan Batt,Ashley Dyke,Kelsey Scott,Quvenzhané Wallis,Cameron Zeigler,Tony Bentley,Scoot McNairy,Taran Killam,Christopher Berry,Bill Camp,Mister Mackey Jr.,Chris Chalk","Biography,Drama,History,Back to top","In the antebellum United States, Solomon Northup, a free black man from upstate New York, is abducted and sold into slavery.",R,United States
Before Sunrise,1995,8.1,"1,h, ,41,m","Ethan Hawke,Julie Delpy,Andrea Eckert,Hanno Pöschl,Karl Bruckschwaiger,Tex Rubinowitz,Erni Mangold,Dominik Castell,Haymon Maria Buttinger,Harald Waiglein,Bilge Jeschim,Kurti,Hans Weingartner,Liese Lyon,Peter Ily Huemer,Otto Reiter,Hubert Fabian Kulterer,Branko Andric","Drama,Romance,Back to top","A young man and woman meet on a train in Europe, and wind up spending one evening together in Vienna. Unfortunately, both know that this will probably be their only night together.",R,United States
On the Waterfront,1954,8.1,"1,h, ,48,m","Marlon Brando,Karl Malden,Lee J. Cobb,Rod Steiger,Pat Henning,Leif Erickson,James Westerfield,Tony Galento,Tami Mauriello,John F. Hamilton,John Heldabrand,Rudy Bond,Don Blackman,Arthur Keegan,Abe Simon,Eva Marie Saint,Martin Balsam,Dan Bergin","Crime,Drama,Thriller,Back to top","An ex-prize fighter turned New Jersey longshoreman struggles to stand up to his corrupt union bosses, including his older brother, as he starts to connect with the grieving sister of one of the syndicate's victims.",Approved,United States
Blade Runner,1982,8.1,"1,h, ,57,m","Harrison Ford,Rutger Hauer,Sean Young,Edward James Olmos,M. Emmet Walsh,Daryl Hannah,William Sanderson,Brion James,Joe Turkel,Joanna Cassidy,James Hong,Morgan Paull,Kevin Thompson,John Edward Allen,Hy Pyke,Kimiko Hiroshige,Bob Okazaki,Carolyn DeMirjian","Action,Drama,Sci-Fi,Back to top",A blade runner must pursue and terminate four replicants who stole a ship in space and have returned to Earth to find their creator.,R,United States
The Gold Rush,1925,8.2,"1,h, ,35,m","Charles Chaplin,Mack Swain,Tom Murray,Henry Bergman,Malcolm Waite,Georgia Hale,Jack Adams,Frank Aderias,Leona Aderias,Lillian Adrian,Sam Allen,Claude Anderson,Harry Arras,Albert Austin,Marta Belfort,William Bell,Francis Bernhardt,F.J. Beuaregard","Adventure,Comedy,Drama,Back to top","A prospector goes to the Klondike during the 1890s gold rush in hopes of making his fortune, and is smitten with a girl he sees in a dance hall.",Passed,United States
Children of Heaven,1997,8.2,"1,h, ,29,m","Mohammad Amir Naji,Amir Farrokh Hashemian,Bahare Seddiqi,Nafise Jafar-Mohammadi,Fereshte Sarabandi,Kamal Mirkarimi,Behzad Rafi,Dariush Mokhtari,Mohammad-Hasan Hosseinian,Masume Dair,Kambiz Peykarnegar,Hasan Roohparvari,Abbas-Ali Roomandi,Jafar Seyfollahi,Qolamreza Maleki,Zahra Mirzai,Sara Zamani,Mohammad Haj-Hosseini","Drama,Family,Sport,Back to top","After a boy loses his sister's pair of shoes, he goes on a series of adventures in order to find them. When he can't, he tries a new way to ""win"" a new pair.",PG,Iran
Million Dollar Baby,2004,8.1,"2,h, ,12,m","Hilary Swank,Clint Eastwood,Morgan Freeman,Jay Baruchel,Mike Colter,Lucia Rijker,Brían F. O'Byrne,Anthony Mackie,Margo Martindale,Riki Lindhome,Michael Peña,Benito Martinez,Bruce MacVittie,David Powledge,Joe D'Angerio,Marcus Chait,Tom McCleister,Erica Grant","Drama,Sport,Back to top",A determined woman works with a hardened boxing trainer to become a professional.,PG-13,United States
My Neighbor Totoro,1988,8.1,"1,h, ,26,m","Hitoshi Takagi,Noriko Hidaka,Chika Sakamoto,Shigesato Itoi,Sumi Shimamoto,Tanie Kitabayashi,Hiroko Maruyama,Machiko Washio,Reiko Suzuki,Masashi Hirose,Toshiyuki Amagasa,Shigeru Chiba,Naoki Tatsuta,Tarako,Tomohiro Nishimura,Mitsuko Ishida,Chie Kôjiro,Daiki Nakamura","Animation,Comedy,Family,Back to top","When two girls move to the country to be near their ailing mother, they have adventures with the wondrous forest spirits who live nearby.",G,Japan
Catch Me If You Can,2002,8.1,"2,h, ,21,m","Leonardo DiCaprio,Tom Hanks,Christopher Walken,Martin Sheen,Nathalie Baye,Amy Adams,James Brolin,Brian Howe,Frank John Hughes,Steve Eastin,Chris Ellis,John Finn,Jennifer Garner,Nancy Lenehan,Ellen Pompeo,Elizabeth Banks,Guy Thauvette,Candice Azzara","Biography,Crime,Drama,Back to top","Barely 21 yet, Frank is a skilled forger who has passed as a doctor, lawyer and pilot. FBI agent Carl becomes obsessed with tracking down the con man, who only revels in the pursuit.",PG-13,United States
Gran Torino,2008,8.1,"1,h, ,56,m","Clint Eastwood,Bee Vang,Christopher Carley,Ahney Her,Brian Haley,Geraldine Hughes,Dreama Walker,Brian Howe,John Carroll Lynch,William Hill,Brooke Chia Thao,Chee Thao,Choua Kue,Scott Eastwood,Xia Soua Chang,Sonny Vue,Doua Moua,Greg Trzaskoma","Drama,Back to top","Disgruntled Korean War veteran Walt Kowalski sets out to reform his neighbor, Thao Lor, a Hmong teenager who tried to steal Kowalski's prized possession: a 1972 Gran Torino.",R,Germany
"Three Billboards Outside Ebbing, Missouri",2017,8.1,"1,h, ,55,m","Frances McDormand,Woody Harrelson,Sam Rockwell,Caleb Landry Jones,Kerry Condon,Alejandro Barrios,Clarke Peters,Darrell Britt-Gibson,Abbie Cornish,Riya May Atwood,Selah Atwood,Lucas Hedges,Zeljko Ivanek,Amanda Warren,Malaya Rivera Drew,Sandy Martin,Peter Dinklage,Christopher Berry","Comedy,Crime,Drama,Back to top",A mother personally challenges the local authorities to solve her daughter's murder when they fail to catch the culprit.,R,United Kingdom
Prisoners,2013,8.1,"2,h, ,33,m","Hugh Jackman,Jake Gyllenhaal,Viola Davis,Melissa Leo,Maria Bello,Terrence Howard,Paul Dano,Dylan Minnette,Zoë Soul,Erin Gerasimovich,Kyla-Drew,Wayne Duvall,Len Cariou,David Dastmalchian,Brad James,Anthony Reynolds,Robert C. Treveiler,Sandra Ellis Lafferty","Crime,Drama,Mystery,Back to top","When Keller Dover's daughter and her friend go missing, he takes matters into his own hands as the police pursue multiple leads and the pressure mounts.",R,United States
Fargo,1996,8.1,"1,h, ,38,m","William H. Macy,Frances McDormand,Steve Buscemi,Peter Stormare,Kristin Rudrüd,Harve Presnell,Tony Denman,Gary Houston,Sally Wingert,Kurt Schweickhardt,Larissa Kokernot,Melissa Peterman,Steve Reevis,Warren Keith,Steve Edelman,Sharon Anderson,Larry Brandenburg,James Gaulke","Crime,Thriller,Back to top",Minnesota car salesman Jerry Lundegaard's inept crime falls apart due to his and his henchmen's bungling and the persistent police work of the quite pregnant Marge Gunderson.,R,United States
Warrior,2011,8.2,"2,h, ,20,m","Tom Hardy,Nick Nolte,Joel Edgerton,Jennifer Morrison,Frank Grillo,Kevin Dunn,Maximiliano Hernández,Bryan Callen,Sam Sheridan,Fernando Chien,Jake McLaughlin,Vanessa Martinez,Denzel Whitaker,Carlos Miranda,Nick Lehane,Laura Chinn,Capri Thomas,Lexi Cowan","Action,Drama,Sport,Back to top","The youngest son of an alcoholic former boxer returns home, where he's trained by his father for competition in a mixed martial arts tournament - a path that puts the fighter on a collision course with his estranged, older brother.",PG-13,United States
Trainspotting,1996,8.1,"1,h, ,33,m","Ewan McGregor,Ewen Bremner,Jonny Lee Miller,Kevin McKidd,Robert Carlyle,Kelly Macdonald,Peter Mullan,James Cosmo,Eileen Nicholas,Susan Vidler,Pauline Lynch,Shirley Henderson,Stuart McQuarrie,Irvine Welsh,Dale Winton,Keith Allen,Kevin Allen,Annie Louise Ross","Drama,Back to top","Renton, deeply immersed in the Edinburgh drug scene, tries to clean up and get out, despite the allure of the drugs and influence of friends.",R,United Kingdom
The Bridge on the River Kwai,1957,8.2,"2,h, ,41,m","William Holden,Alec Guinness,Jack Hawkins,Sessue Hayakawa,James Donald,Geoffrey Horne,André Morell,Peter Williams,John Boxer,Percy Herbert,Harold Goodwin,Ann Sears,Heihachirô Ôkawa,Keiichirô Katsumoto,M.R.B. Chakrabandhu,Vilaiwan Seeboonreaung,Ngamta Suphaphongs,Javanart Punynchoti","Adventure,Drama,War,Back to top","British POWs are forced to build a railway bridge across the river Kwai for their Japanese captors in occupied Burma, not knowing that the allied forces are planning a daring commando raid through the jungle to destroy it.",PG,United Kingdom
Howl's Moving Castle,2004,8.2,"1,h, ,59,m","Chieko Baishô,Takuya Kimura,Tatsuya Gashûin,Akihiro Miwa,Ryûnosuke Kamiki,Mitsunori Isaki,Yô Ôizumi,Akio Ôtsuka,Daijirô Harada,Haruko Katô,Jean Simmons,Christian Bale,Lauren Bacall,Blythe Danner,Emily Mortimer,Josh Hutcherson,Billy Crystal,Jena Malone","Animation,Adventure,Family,Back to top","When an unconfident young woman is cursed with an old body by a spiteful witch, her only chance of breaking the spell lies with a self-indulgent yet insecure young wizard and his companions in his legged, walking castle.",PG,Japan
