Nom du film,Annee,Score,Duree,Acteur,Genre,Description,Public,Pays
The Shawshank Redemption,1994,9.3,"2,h, ,22,m","Tim Robbins,Morgan Freeman,Bob Gunton,William Sadler,Clancy Brown,Gil Bellows,Mark Rolston,James Whitmore,Jeffrey DeMunn,Larry Brandenburg,Neil Giuntoli,Brian Libby,David Proval,Joseph Ragno,Jude Ciccolella,Paul McCrane,Renee Blaine,Scott Mann","Drama,Back to top","Two imprisoned men bond over a number of years, finding solace and eventual redemption through acts of common decency.",R,United States
Cinema Paradiso,1988,8.5,"2,h, ,35,m","Philippe Noiret,Enzo Cannavale,Antonella Attili,Isa Danieli,Leo Gullotta,Marco Leonardi,Pupella Maggio,Agnese Nano,Leopoldo Trieste,Salvatore Cascio,Tano Cimarosa,Nicola Di Pinto,Roberta Lena,Nino Terzo,Jacques Perrin,Nellina Laganà,Turi Giuffrida,Mariella Lo Giudice","Drama,Romance,Back to top",A filmmaker recalls his childhood when falling in love with the pictures at the cinema of his home village and forms a deep friendship with the cinema's projectionist.,PG,Italy
The Intouchables,2011,8.5,"1,h, ,52,m","François Cluzet,Omar Sy,Anne Le Ny,Audrey Fleurot,Joséphine de Meaux,Clotilde Mollet,Alba Gaïa Bellugi,Cyril Mendy,Salimata Kamate,Absa Diatou Toure,Grégoire Oestermann,Dominique Daguier,François Caron,Christian Ameri,Thomas Solivérès,Dorothée Brière,Marie-Laure Descoureaux,Émilie Caen","Biography,Comedy,Drama,Back to top","After he becomes a quadriplegic from a paragliding accident, an aristocrat hires a young man from the projects to be his caregiver.",R,France
Alien,1979,8.5,"1,h, ,57,m","Sigourney Weaver,Tom Skerritt,John Hurt,Veronica Cartwright,Harry Dean Stanton,Ian Holm,Yaphet Kotto,Bolaji Badejo,Helen Horton,Eddie Powell","Horror,Sci-Fi,Back to top",The crew of a commercial spacecraft encounter a deadly lifeform after investigating an unknown transmission.,R,United Kingdom
Rear Window,1954,8.5,"1,h, ,52,m","James Stewart,Grace Kelly,Wendell Corey,Thelma Ritter,Raymond Burr,Judith Evelyn,Ross Bagdasarian,Georgine Darcy,Sara Berner,Frank Cady,Jesslyn Fax,Rand Harper,Irene Winston,Havis Davenport,Jerry Antes,Barbara Bailey,Benny Bartlett,Nick Borgani","Mystery,Thriller,Back to top","A wheelchair-bound photographer spies on his neighbors from his Greenwich Village courtyard apartment window, and becomes convinced one of them has committed murder, despite the skepticism of his fashion-model girlfriend.",PG,United States
Once Upon a Time in the West,1968,8.5,"2,h, ,45,m","Henry Fonda,Charles Bronson,Claudia Cardinale,Jason Robards,Gabriele Ferzetti,Paolo Stoppa,Woody Strode,Jack Elam,Keenan Wynn,Frank Wolff,Lionel Stander,Livio Andronico,Salvatore Basile,Aldo Berti,Joseph Bradley,Frank Braña,Marilù Carteny,Saturno Cerra","Western,Back to top",A mysterious stranger with a harmonica joins forces with a notorious desperado to protect a beautiful widow from a ruthless assassin working for the railroad.,PG-13,Italy
Grave of the Fireflies,1988,8.5,"1,h, ,29,m","Tsutomu Tatsumi,Ayano Shiraishi,Akemi Yamaguchi,Yoshiko Shinohara,Kôzô Hashida,Masayo Sakai,Kazumi Nozaki,Yoshio Matsuoka,Masahiro Kanetake,Kiyoshi Yanagawa,Hajime Maki,Atsuo Omote,Teruhisa Harita,Hiroshi Tanaka,Michio Denpô,Shirô Tamaki,Tadashi Nakamura,Mika Sekita","Animation,Drama,War,Back to top",A young boy and his little sister struggle to survive in Japan during World War II.,Not Rated,Japan
Modern Times,1936,8.5,"1,h, ,27,m","Charles Chaplin,Paulette Goddard,Henry Bergman,Tiny Sandford,Chester Conklin,Hank Mann,Stanley Blystone,Al Ernest Garcia,Richard Alexander,Cecil Reynolds,Mira McKinney,Murdock MacQuarrie,Wilfred Lucas,Edward LeSaint,Fred Malatesta,Sammy Stein,Juana Sutton,Ted Oliver","Comedy,Drama,Romance,Back to top",The Tramp struggles to live in modern industrial society with the help of a young homeless woman.,G,United States
Whiplash,2014,8.5,"1,h, ,46,m","Miles Teller,J.K. Simmons,Melissa Benoist,Paul Reiser,Austin Stowell,Nate Lang,Chris Mulkey,Damon Gupton,Suanne Spoke,Max Kasch,Charlie Ian,Jayson Blair,Kofi Siriboe,Kavita Patil,C.J. Vana,Tarik Lowe,Tyler Kimball,Rogelio Douglas Jr.","Drama,Music,Back to top",A promising young drummer enrolls at a cut-throat music conservatory where his dreams of greatness are mentored by an instructor who will stop at nothing to realize a student's potential.,R,United States
Casablanca,1942,8.5,"1,h, ,42,m","Humphrey Bogart,Ingrid Bergman,Paul Henreid,Claude Rains,Conrad Veidt,Sydney Greenstreet,Peter Lorre,S.Z. Sakall,Madeleine Lebeau,Dooley Wilson,Joy Page,John Qualen,Leonid Kinskey,Curt Bois,Abdullah Abbas,Enrique Acosta,Ed Agresti,Arnet Amos","Drama,Romance,War,Back to top",A cynical expatriate American cafe owner struggles to decide whether or not to help his former lover and her fugitive husband escape the Nazis in French Morocco.,PG,United States
The Prestige,2006,8.5,"2,h, ,10,m","Christian Bale,Hugh Jackman,Scarlett Johansson,Michael Caine,Piper Perabo,Rebecca Hall,Samantha Mahurin,David Bowie,Andy Serkis,Daniel Davis,Jim Piddock,Christopher Neame,Mark Ryan,Roger Rees,Jamie Harris,Monty Stuart,Ron Perkins,Ricky Jay","Drama,Mystery,Sci-Fi,Back to top","After a tragic accident, two stage magicians in 1890s London engage in a battle to create the ultimate illusion while sacrificing everything they have to outwit each other.",PG-13,United Kingdom
The Usual Suspects,1995,8.5,"1,h, ,46,m","Kevin Spacey,Gabriel Byrne,Chazz Palminteri,Stephen Baldwin,Benicio Del Toro,Kevin Pollak,Pete Postlethwaite,Suzy Amis,Giancarlo Esposito,Dan Hedaya,Paul Bartel,Carl Bressler,Phillipe Simon,Jack Shearer,Christine Estabrook,Clark Gregg,Morgan Hunter,Ken Daly","Crime,Drama,Mystery,Back to top","A sole survivor tells of the twisty events leading up to a horrific gun battle on a boat, which began when five criminals met at a seemingly random police lineup.",R,United States
The Departed,2006,8.5,"2,h, ,31,m","Leonardo DiCaprio,Matt Damon,Jack Nicholson,Mark Wahlberg,Martin Sheen,Ray Winstone,Vera Farmiga,Anthony Anderson,Alec Baldwin,Kevin Corrigan,James Badge Dale,David O'Hara,Mark Rolston,Robert Wahlberg,Kristen Dalton,Thomas B. Duffy,Richard Hughes,J.C. MacKenzie","Crime,Drama,Thriller,Back to top",An undercover cop and a mole in the police attempt to identify each other while infiltrating an Irish gang in South Boston.,R,United States
Gladiator,2000,8.5,"2,h, ,35,m","Russell Crowe,Joaquin Phoenix,Connie Nielsen,Oliver Reed,Richard Harris,Derek Jacobi,Djimon Hounsou,David Schofield,John Shrapnel,Tomas Arana,Ralf Moeller,Spencer Treat Clark,David Hemmings,Tommy Flanagan,Sven-Ole Thorsen,Omid Djalili,Nicholas McGaughey,Chris Kell","Action,Adventure,Drama,Back to top",A former Roman General sets out to exact vengeance against the corrupt emperor who murdered his family and sent him into slavery.,R,United States
American History X,1998,8.5,"1,h, ,59,m","Edward Norton,Edward Furlong,Beverly D'Angelo,Jennifer Lien,Ethan Suplee,Fairuza Balk,Avery Brooks,Elliott Gould,Stacy Keach,William Russ,Guy Torry,Joe Cortese,Jason Bose Smith,Antonio David Lyons,Alex Sol,Keram Malicki-Sánchez,Giuseppe Andrews,Michelle Christine White","Crime,Drama,Back to top",A former neo-nazi skinhead tries to prevent his younger brother from going down the same wrong path that he did.,R,United States
Gandhi,1982,8.1,"3,h, ,11,m","Ben Kingsley,John Gielgud,Rohini Hattangadi,Roshan Seth,Candice Bergen,Edward Fox,Trevor Howard,John Mills,Martin Sheen,Ian Charleson,Günther Maria Halmer,Athol Fugard,Saeed Jaffrey,Geraldine James,Alyque Padamsee,Amrish Puri,Ian Bannen,Michael Bryant","Biography,Drama,History,Back to top",The life of the lawyer who became the famed leader of the Indian revolts against the British rule through his philosophy of nonviolent protest.,PG,United Kingdom
The Help,2011,8.1,"2,h, ,26,m","Viola Davis,Emma Stone,Octavia Spencer,Bryce Dallas Howard,Jessica Chastain,Ahna O'Reilly,Allison Janney,Anna Camp,Eleanor Henry,Emma Henry,Christopher Lowell,Cicely Tyson,Mike Vogel,Sissy Spacek,Brian Kerwin,Wes Chatham,Aunjanue Ellis,Ted Welch","Drama,Back to top","An aspiring author during the civil rights movement of the 1960s decides to write a book detailing the African American maids' point of view on the white families for which they work, and the hardships they go through on a daily basis.",PG-13,United States
The Iron Giant,1999,8.1,"1,h, ,26,m","Eli Marienthal,Harry Connick Jr.,Jennifer Aniston,Vin Diesel,James Gammon,Cloris Leachman,Christopher McDonald,John Mahoney,M. Emmet Walsh,Jack Angel,Bob Bergen,Mary Kay Bergman,Michael Bird,Devon Cole Borisoff,Rodger Bumpass,Robert Clotworthy,Jennifer Darling,Zack Eginton","Animation,Action,Adventure,Back to top",A young boy befriends a giant robot from outer space that a paranoid government agent wants to destroy.,PG,United States
Aladdin,1992,8.0,"1,h, ,30,m","Scott Weinger,Robin Williams,Linda Larkin,Jonathan Freeman,Frank Welker,Gilbert Gottfried,Douglas Seale,Charlie Adler,Jack Angel,Corey Burton,Philip L. Clarke,Jim Cummings,Jennifer Darling,Debi Derryberry,Bruce Gooch,Jerry Houser,Vera Lockwood,Sherry Lynn","Animation,Adventure,Comedy,Back to top",A kindhearted street urchin and a power-hungry Grand Vizier vie for a magic lamp that has the power to make their deepest wishes come true.,G,United States
The Sound of Music,1965,8.1,"2,h, ,52,m","Julie Andrews,Christopher Plummer,Eleanor Parker,Richard Haydn,Peggy Wood,Charmian Carr,Heather Menzies-Urich,Nicholas Hammond,Duane Chase,Angela Cartwright,Debbie Turner,Kym Karath,Anna Lee,Portia Nelson,Ben Wright,Daniel Truhitte,Norma Varden,Gilchrist Stuart","Biography,Drama,Family,Back to top",A young novitiate is sent by her convent in 1930s Austria to become a governess to the seven children of a widowed naval officer.,G,United States
Life of Brian,1979,8.0,"1,h, ,34,m","Graham Chapman,John Cleese,Michael Palin,Terry Gilliam,Eric Idle,Terry Jones,Terence Bayler,Carol Cleveland,Kenneth Colley,Neil Innes,Charles McKeown,John Young,Gwen Taylor,Sue Jones-Davies,Peter Brett,John Case,Chris Langham,Andrew MacLachlan","Comedy,Back to top","Born on the original Christmas in the stable next door to Jesus Christ, Brian of Nazareth spends his life being mistaken for a messiah.",R,United Kingdom
Everything Everywhere All at Once,2022,8.1,"2,h, ,19,m","Michelle Yeoh,Stephanie Hsu,Jamie Lee Curtis,Ke Huy Quan,James Hong,Tallie Medel,Jenny Slate,Harry Shum Jr.,Randy Newman,Biff Wiff,Sunita Mani,Aaron Lazar,Brian Le,Andy Le,Narayana Cabral,Chelsey Goldsmith,Craig Henningsen,Anthony Molinari","Action,Adventure,Comedy,Back to top","An aging Chinese immigrant is swept up in an insane adventure, in which she alone can save the world by exploring other universes connecting with the lives she could have led.",R,United States
Dersu Uzala,1975,8.2,"2,h, ,22,m","Maksim Munzuk,Yuriy Solomin,Mikhail Bychkov,Vladimir Khrulyov,V. Lastochkin,Stanislav Marin,Igor Sykhra,Vladimir Sergiyakov,Yanis Yakobsons,Vladimir Khlestov,G. Polunin,V. Koldin,M. Tetov,S. Sinyavskiy,Vladimir Sverba,V. Ignatov,Vladimir Kremena,Aleksandr Pyatkov","Adventure,Biography,Drama,Back to top",The Russian army sends an explorer on an expedition to the snowy Siberian wilderness where he makes friends with a seasoned local hunter.,G,Soviet Union
Persona,1966,8.1,"1,h, ,23,m","Bibi Andersson,Liv Ullmann,Margaretha Krook,Gunnar Björnstrand,Jörgen Lindström","Drama,Thriller,Back to top",A nurse is put in charge of a mute actress and finds that their personae are melding together.,Not Rated,Sweden
It Happened One Night,1934,8.1,"1,h, ,45,m","Clark Gable,Claudette Colbert,Walter Connolly,Roscoe Karns,Jameson Thomas,Alan Hale,Arthur Hoyt,Blanche Friderici,Charles C. Wilson,Ernie Adams,Jessie Arnold,Irving Bacon,William Bailey,William Begg,William A. Boardway,Ward Bond,Harry C. Bradley,George P. Breakston","Comedy,Romance,Back to top","A renegade reporter trailing a young runaway heiress for a big story joins her on a bus heading from Florida to New York, and they end up stuck with each other when the bus leaves them behind at one of the stops.",Passed,United States
The Handmaiden,2016,8.1,"2,h, ,25,m","Kim Min-hee,Ha Jung-woo,Cho Jin-woong,Moon So-ri,Kim Tae-ri,Yong-nyeo Lee,Min-chae Yoo,Dong-hwi Lee,Kim Hae-sook,Kyu-jung Lee,Si-eun Kim,Si-yeon Ha,Rina Takagi,Geun-hee Won,Jong-Dae Kim,Han-sun Jang,Eun-yeong Kim,Ri-woo Kim","Drama,Romance,Thriller,Back to top","A woman is hired as a handmaiden to a Japanese heiress, but secretly she is involved in a plot to defraud her.",Not Rated,South Korea
Cool Hand Luke,1967,8.1,"2,h, ,7,m","Paul Newman,George Kennedy,Strother Martin,J.D. Cannon,Lou Antonio,Robert Drivas,Jo Van Fleet,Clifton James,Morgan Woodward,Luke Askew,Marc Cavell,Richard Davalos,Robert Donner,Warren Finnerty,Dennis Hopper,John McLiam,Wayne Rogers,Harry Dean Stanton","Crime,Drama,Back to top","A laid back Southern man is sentenced to two years in a rural prison, but refuses to conform.",GP,United States
The 400 Blows,1959,8.1,"1,h, ,39,m","Jean-Pierre Léaud,Albert Rémy,Claire Maurier,Guy Decomble,Georges Flamant,Patrick Auffay,Daniel Couturier,François Nocher,Richard Kanayan,Renaud Fontanarosa,Michel Girard,Serge Moati,Bernard Abbou,Jean-François Bergouignan,Michel Lesignor,Luc Andrieux,Robert Beauvais,Bouchon","Crime,Drama,Back to top","A young boy, left without attention, delves into a life of petty crime.",Not Rated,France
My Father and My Son,2005,8.2,"1,h, ,52,m","Çetin Tekindor,Fikret Kuskan,Hümeyra,Ege Tanman,Serif Sezer,Yetkin Dikinciler,Binnur Kaya,Mahmut Gökgöz,Nergis Çorakçi,Bilge Sen,Tuba Büyüküstün,Özge Özberk,Erdal Tosun,Halit Ergenç,Tugyan Akay Kavukçu,Ege Kaya,Muzaffer Demirel,Burak Akçakaya","Drama,Family,Back to top",The family of a left-wing journalist is torn apart after the military coup of Turkey in 1980.,Not Rated,Turkey
Amores Perros,2000,8.1,"2,h, ,34,m","Emilio Echevarría,Gael García Bernal,Goya Toledo,Álvaro Guerrero,Vanessa Bauche,Jorge Salinas,Marco Pérez,Rodrigo Murray,Humberto Busto,Gerardo Campbell,Rosa María Bianchi,Dunia Saldívar,Adriana Barraza,José Sefami,Lourdes Echevarría,Laura Almela,Ricardo Dalmacci,Gustavo Sánchez Parra","Drama,Thriller,Back to top","A horrific car accident connects three stories, each involving characters dealing with loss, regret, and life's harsh realities, all in the name of love.",R,Mexico
Rebecca,1940,8.1,"2,h, ,10,m","Laurence Olivier,Joan Fontaine,George Sanders,Judith Anderson,Nigel Bruce,Reginald Denny,C. Aubrey Smith,Gladys Cooper,Florence Bates,Melville Cooper,Leo G. Carroll,Leonard Carey,Lumsden Hare,Edward Fielding,Philip Winter,Forrester Harvey,Bunny Beatty,Billy Bevan","Drama,Film-Noir,Mystery,Back to top",A self-conscious woman juggles adjusting to her new role as an aristocrat's wife and avoiding being intimidated by his first wife's spectral presence.,Approved,United States
The Grapes of Wrath,1940,8.1,"2,h, ,9,m","Henry Fonda,Jane Darwell,John Carradine,Charley Grapewin,Dorris Bowdon,Russell Simpson,O.Z. Whitehead,John Qualen,Eddie Quillan,Zeffie Tilbury,Frank Sully,Frank Darien,Darryl Hickman,Shirley Mills,Roger Imhof,Grant Mitchell,Charles D. Brown,John Arledge","Drama,Back to top","An Oklahoma family, driven off their farm by the poverty and hopelessness of the Dust Bowl, joins the westward migration to California, suffering the misfortunes of the homeless in the Great Depression.",Passed,United States
La haine,1995,8.1,"1,h, ,38,m","Vincent Cassel,Hubert Koundé,Saïd Taghmaoui,Abdel Ahmed Ghili,Solo,Joseph Momo,Héloïse Rauth,Rywka Wajsbrot,Olga Abrego,Laurent Labasse,Choukri Gabteni,Nabil Ben Mhamed,Benoît Magimel,Médard Niang,Arash Mansour,Abdel-Moulah Boujdouni,Mathilde Vitry,Christian Moro","Crime,Drama,Back to top",24 hours in the lives of three young men in the French suburbs the day after a violent riot.,Not Rated,France
Pirates of the Caribbean: The Curse of the Black Pearl,2003,8.1,"2,h, ,23,m","Johnny Depp,Geoffrey Rush,Orlando Bloom,Keira Knightley,Jack Davenport,Jonathan Pryce,Lee Arenberg,Mackenzie Crook,Damian O'Hare,Giles New,Angus Barnett,David Bailie,Michael Berry Jr.,Isaac C. Singleton Jr.,Kevin McNally,Treva Etienne,Zoe Saldana,Guy Siner","Action,Adventure,Fantasy,Back to top","Blacksmith Will Turner teams up with eccentric pirate ""Captain"" Jack Sparrow to save his love, the governor's daughter, from Jack's former pirate allies, who are now undead.",PG-13,United States
Jai Bhim,2021,8.8,"2,h, ,44,m","Suriya,Lijo Mol Jose,Manikandan K.,Rajisha Vijayan,Prakash Raj,Rao Ramesh,Guru Somasundaram,M.S. Bhaskar,V. Jayaprakash,Sibi Thomas,Ilavarasu,Jayarao,Sujatha Sivakumar,Ravi Venkatraman,Tamizh,Kumaravel,Supergood Subramani,Bala Hasan","Crime,Drama,Mystery,Back to top","When a tribal man is arrested for a case of alleged theft, his wife turns to a human-rights lawyer to help bring justice.",TV-MA,India
Hachi: A Dog's Tale,2009,8.1,"1,h, ,33,m","Richard Gere,Joan Allen,Cary-Hiroyuki Tagawa,Sarah Roemer,Jason Alexander,Erick Avari,Davenia McFadden,Robbie Sublett,Kevin DeCoste,Rob Degnan,Tora Hallström,Donna Sorbello,Frank S. Aronson,Troy Doherty,Ian Sherman,Timothy Crowe,Denece Ryland,Blake Friedman","Biography,Drama,Family,Back to top",A college professor bonds with an abandoned dog he takes into his home.,G,United Kingdom
To Be or Not to Be,1942,8.2,"1,h, ,39,m","Carole Lombard,Jack Benny,Robert Stack,Felix Bressart,Lionel Atwill,Stanley Ridges,Sig Ruman,Tom Dugan,Charles Halton,George Lynn,Henry Victor,Maude Eburne,Halliwell Hobbes,Miles Mander,Rudolph Anders,Paul Barrett,Sven Hugo Borg,Danny Borzage","Comedy,Romance,War,Back to top","During the Nazi occupation of Poland, an acting troupe becomes embroiled in a Polish soldier's efforts to track down a German spy.",Passed,United States
The Battle of Algiers,1966,8.1,"2,h, ,1,m","Brahim Hadjadj,Jean Martin,Yacef Saadi,Samia Kerbash,Ugo Paletti,Fusia El Kader,Mohamed Ben Kassen,Franco Moruzzi,Tommaso Neri,Rouïched,Gene Wesson","Drama,War,Back to top","In the 1950s, fear and violence escalate as the people of Algiers fight for independence from the French government.",Not Rated,Italy
The Incredibles,2004,8.0,"1,h, ,55,m","Craig T. Nelson,Samuel L. Jackson,Holly Hunter,Jason Lee,Dominique Louis,Teddy Newton,Jean Sincere,Eli Fucile,Maeve Andrews,Wallace Shawn,Spencer Fox,Lou Romano,Wayne Canney,Sarah Vowell,Michael Bird,Elizabeth Peña,Bud Luckey,Brad Bird","Animation,Action,Adventure,Back to top","While trying to lead a quiet suburban life, a family of undercover superheroes are forced into action to save the world.",PG,United States
The Best Years of Our Lives,1946,8.1,"2,h, ,50,m","Myrna Loy,Dana Andrews,Fredric March,Teresa Wright,Virginia Mayo,Cathy O'Donnell,Hoagy Carmichael,Harold Russell,Gladys George,Roman Bohnen,Ray Collins,Minna Gombell,Walter Baldwin,Steve Cochran,Dorothy Adams,Don Beddoe,Marlene Aames,Charles Halton","Drama,Romance,War,Back to top","Three World War II veterans, two of them traumatized or disabled, return home to the American midwest to discover that they and their families have been irreparably changed.",Approved,United States
Harakiri,1962,8.6,"2,h, ,13,m","Tatsuya Nakadai,Akira Ishihama,Shima Iwashita,Tetsurô Tanba,Masao Mishima,Ichirô Nakatani,Kei Satô,Yoshio Inaba,Hisashi Igawa,Tôru Takeuchi,Yoshirô Aoki,Tatsuo Matsumura,Akiji Kobayashi,Kôichi Hayashi,Ryûtarô Gomi,Jô Azumi,Nakajirô Tomita,Shichisaburô Amatsu","Action,Drama,Mystery,Back to top","When a ronin requesting seppuku at a feudal lord's palace is told of the brutal suicide of another ronin who previously visited, he reveals how their pasts are intertwined - and in doing so challenges the clan's integrity.",Not Rated,Japan
The Exorcist,1973,8.1,"2,h, ,2,m","Ellen Burstyn,Max von Sydow,Linda Blair,Lee J. Cobb,Kitty Winn,Jack MacGowran,Jason Miller,William O'Malley,Barton Heyman,Peter Masterson,Rudolf Schündler,Gina Petrushka,Robert Symonds,Arthur Storch,Thomas Bermingham,Vasiliki Maliaros,Titos Vandis,John Mahon","Horror,Back to top","When a teenage girl is possessed by a mysterious entity, her mother seeks the help of two priests to save her daughter.",R,United States
Groundhog Day,1993,8.1,"1,h, ,41,m","Bill Murray,Andie MacDowell,Chris Elliott,Stephen Tobolowsky,Brian Doyle-Murray,Marita Geraghty,Angela Paton,Rick Ducommun,Rick Overton,Robin Duke,Carol Bivins,Willie Garson,Ken Hudson Campbell,Les Podewell,Rod Sell,Tom Milanovich,John M. Watson Sr.,Peggy Roeder","Comedy,Drama,Fantasy,Back to top","A narcissistic, self-centered weatherman finds himself in a time loop on Groundhog Day, and the day keeps repeating until he gets it right.",PG,United States
Before Sunset,2004,8.1,"1,h, ,20,m","Ethan Hawke,Julie Delpy,Vernon Dobtcheff,Louise Lemoine Torrès,Rodolphe Pauly,Mariane Plasteig,Diabolo,Denis Evrard,Albert Delpy,Marie Pillet","Drama,Romance,Back to top","Nine years after Jesse and Celine first met, they encounter each other again on the French leg of Jesse's book tour.",R,United States
Into the Wild,2007,8.1,"2,h, ,28,m","Emile Hirsch,Vince Vaughn,Catherine Keener,Marcia Gay Harden,William Hurt,Jena Malone,Brian H. Dierker,Kristen Stewart,Hal Holbrook,Jim Gallien,James O'Neill,Malinda McCollum,Paul Knauls,Zach Galifianakis,Craig Mutsch,Jim Beidler,John Decker,John Hofer","Adventure,Biography,Drama,Back to top","After graduating from Emory University, top student and athlete Christopher McCandless abandons his possessions, gives his entire $24,000 savings account to charity and hitchhikes to Alaska to live in the wilderness. Along the way, Christopher encounters a series of characters that shape his life.",R,United States
The Wizard of Oz,1939,8.1,"1,h, ,42,m","Judy Garland,Frank Morgan,Ray Bolger,Bert Lahr,Jack Haley,Billie Burke,Margaret Hamilton,Charley Grapewin,Pat Walshe,Clara Blandick,Terry,The Singer Midgets,Franz Balluck,Josefine Balluck,Dorothy Barrett,Amelia Batchelor,Charles Becker,Freda Betsky","Adventure,Family,Fantasy,Back to top","Young Dorothy Gale and her dog Toto are swept away by a tornado from their Kansas farm to the magical Land of Oz, and embark on a quest with three new friends to see the Wizard, who can return her to her home and fulfill the others' wishes.",G,United States
Network,1976,8.1,"2,h, ,1,m","Faye Dunaway,William Holden,Peter Finch,Robert Duvall,Wesley Addy,Ned Beatty,Arthur Burghardt,Bill Burrows,John Carpenter,Jordan Charney,Kathy Cronkite,Ed Crowley,Jerome Dempsey,Conchata Ferrell,Gene Gross,Stanley Grover,Cindy Grover,Darryl Hickman","Drama,Back to top","A television network cynically exploits a deranged former anchor's ravings and revelations about the news media for its own profit, but finds that his message may be difficult to control.",R,United States
Pather Panchali,1955,8.3,"2,h, ,5,m","Kanu Bannerjee,Karuna Bannerjee,Subir Banerjee,Chunibala Devi,Uma Das Gupta,Runki Banerjee,Reba Devi,Aparna Devi,Tulsi Chakraborty,Haren Banerjee,Rampada Das,Nibhanani Devi,Rama Gangopadhaya,Roma Ganguli,Binoy Mukherjee,Haridhan Nag,Harimohan Nag,Kshirod Roy","Drama,Back to top","Impoverished priest Harihar Ray, dreaming of a better life for himself and his family, leaves his rural Bengal village in search of work.",Not Rated,India
Logan,2017,8.1,"2,h, ,17,m","Hugh Jackman,Patrick Stewart,Dafne Keen,Boyd Holbrook,Stephen Merchant,Elizabeth Rodriguez,Richard E. Grant,Eriq La Salle,Elise Neal,Quincy Fouse,Al Coronel,Frank Gallegos,Anthony Escobar,Reynaldo Gallegos,Krzysztof Soszynski,Stephen Dunlevy,Daniel Bernhardt,Ryan Sturz","Action,Drama,Sci-Fi,Back to top","In a future where mutants are nearly extinct, an elderly and weary Logan leads a quiet life. But when Laura, a mutant child pursued by scientists, comes to him for help, he must get her to safety.",R,United States
Rush,2013,8.1,"2,h, ,3,m","Daniel Brühl,Chris Hemsworth,Olivia Wilde,Alexandra Maria Lara,Pierfrancesco Favino,David Calder,Natalie Dormer,Stephen Mangan,Christian McKay,Alistair Petrie,Julian Rhind-Tutt,Colin Stinton,Jamie de Courcey,Augusto Dallara,Ilario Calvo,Patrick Baladi,Vincent Riotta,Martin Savage","Action,Biography,Drama,Back to top",The merciless 1970s rivalry between Formula One rivals James Hunt and Niki Lauda.,R,United Kingdom
Spotlight,2015,8.1,"2,h, ,9,m","Mark Ruffalo,Michael Keaton,Rachel McAdams,Liev Schreiber,John Slattery,Brian d'Arcy James,Stanley Tucci,Elena Wohl,Gene Amoroso,Doug Murray,Sharon McFarlane,Jamey Sheridan,Neal Huff,Billy Crudup,Robert B. Kennedy,Duane Murray,Brian Chamberlain,Michael Cyril Creighton","Biography,Crime,Drama,Back to top","The true story of how the Boston Globe uncovered the massive scandal of child molestation and cover-up within the local Catholic Archdiocese, shaking the entire Catholic Church to its core.",R,United States
Stand by Me,1986,8.1,"1,h, ,29,m","Wil Wheaton,River Phoenix,Corey Feldman,Jerry O'Connell,Kiefer Sutherland,Casey Siemaszko,Gary Riley,Bradley Gregg,Jason Oliver Lipsett,Marshall Bell,Frances Lee McCain,Bruce Kirby,William Bronder,Scott Beach,Richard Dreyfuss,John Cusack,Madeleine Swift,Popeye","Adventure,Drama,Back to top","After the death of one of his friends, a writer recounts a childhood journey with his friends to find the body of a missing boy.",R,United States
The Terminator,1984,8.1,"1,h, ,47,m","Arnold Schwarzenegger,Linda Hamilton,Michael Biehn,Paul Winfield,Lance Henriksen,Rick Rossovich,Bess Motta,Earl Boen,Dick Miller,Shawn Schepps,Bruce M. Kerner,Franco Columbu,Bill Paxton,Brad Rearden,Brian Thompson,William Wisher,Ken Fritz,Tom Oberhaus","Action,Sci-Fi,Back to top","A human soldier is sent from 2029 to 1984 to stop an almost indestructible cyborg killing machine, sent from the same year, which has been programmed to execute a young woman whose unborn son is the key to humanity's future salvation.",R,United Kingdom
