Nom du film,Annee,Score,Duree,Acteur,Genre,Description,Public,Pays
Scarface,1983,8.3,"2,h, ,50,m","Al Pacino,Michelle Pfeiffer,Steven Bauer,Mary Elizabeth Mastrantonio,Robert Loggia,Miriam Colon,F. Murray Abraham,Paul Shenar,Harris Yulin,Ángel Salazar,Arnaldo Santana,Pepe Serna,Michael P. Moran,Al Israel,Dennis Holahan,Mark Margolis,Michael Alldredge,Ted Beniades","Crime,Drama,Back to top","In 1980 Miami, a determined Cuban immigrant takes over a drug cartel and succumbs to greed.",R,United States
A Separation,2011,8.3,"2,h, ,3,m","Payman Maadi,Leila Hatami,Sareh Bayat,Shahab Hosseini,Sarina Farhadi,Merila Zare'i,Ali-Asghar Shahbazi,Babak Karimi,Kimia Hosseini,Shirin Yazdanbakhsh,Sohibanoo Zolqadr,Mohammadhasan Asghari,Shirin Azimiyannezhad,Hamid Dadju,Mohammad Ebrahimian,Samad Farhang,Ali Fattahi,Nafise Ghodrati","Drama,Back to top",A married couple are faced with a difficult decision - to improve the life of their child by moving to another country or to stay in Iran and look after a deteriorating parent who has Alzheimer's disease.,PG-13,Iran
Hamilton,2020,8.4,"2,h, ,40,m","Lin-Manuel Miranda,Phillipa Soo,Leslie Odom Jr.,Renée Elise Goldsberry,Daveed Diggs,Jonathan Groff,Chris Jackson,Jasmine Cephas Jones,Okieriete Onaodowan,Anthony Ramos,Carleigh Bettiol,Ariana DeBose,Hope Easterbrook,Sydney James Harcourt,Sasha Hutchings,Thayne Jasperson,Elizabeth Judd,Jon Rua","Biography,Drama,History,Back to top","The real life of one of America's foremost founding fathers and first Secretary of the Treasury, Alexander Hamilton. Captured live on Broadway from the Richard Rodgers Theater with the original Broadway cast.",PG-13,United States
The Sting,1973,8.3,"2,h, ,9,m","Paul Newman,Robert Redford,Robert Shaw,Charles Durning,Ray Walston,Eileen Brennan,Harold Gould,John Heffernan,Dana Elcar,Jack Kehoe,Dimitra Arliss,Robert Earl Jones,James Sloyan,Charles Dierkop,Lee Paul,Sally Kirkland,Avon Long,Arch Johnson","Comedy,Crime,Drama,Back to top",Two grifters team up to pull off the ultimate con.,PG,United States
Full Metal Jacket,1987,8.3,"1,h, ,56,m","Matthew Modine,R. Lee Ermey,Vincent D'Onofrio,Adam Baldwin,Dorian Harewood,Kevyn Major Howard,Arliss Howard,Ed O'Ross,John Terry,Kieron Jecchinis,Kirk Taylor,Tim Colceri,Jon Stafford,Bruce Boa,Ian Tyler,Sal Lopez,Gary Landon Mills,Papillon Soo","Drama,War,Back to top",A pragmatic U.S. Marine observes the dehumanizing effects the Vietnam War has on his fellow recruits from their brutal boot camp training to the bloody street fighting in Hue.,R,United Kingdom
Double Indemnity,1944,8.3,"1,h, ,47,m","Fred MacMurray,Barbara Stanwyck,Edward G. Robinson,Byron Barr,Porter Hall,Jean Heather,Tom Powers,Richard Gaines,Fortunio Bonanova,John Philliber,Lev Abramov,James Adamson,John Berry,Raymond Chandler,Edmund Cobb,Kernan Cripps,Betty Farrington,Bess Flowers","Crime,Drama,Film-Noir,Back to top","A Los Angeles insurance representative lets an alluring housewife seduce him into a scheme of insurance fraud and murder that arouses the suspicion of his colleague, an insurance investigator.",Passed,United States
To Kill a Mockingbird,1962,8.3,"2,h, ,9,m","Gregory Peck,John Megna,Frank Overton,Rosemary Murphy,Ruth White,Brock Peters,Estelle Evans,Paul Fix,Collin Wilcox Paxton,James Anderson,Alice Ghostley,Robert Duvall,William Windom,Crahan Denton,Richard Hale,Mary Badham,Phillip Alford,R.L. Armstrong","Crime,Drama,Back to top","Atticus Finch, a widowed lawyer in Depression-era Alabama, defends a black man against an undeserved rape charge, and his children against prejudice.",Approved,United States
Ikiru,1952,8.3,"2,h, ,23,m","Takashi Shimura,Nobuo Kaneko,Shin'ichi Himori,Haruo Tanaka,Minoru Chiaki,Miki Odagiri,Bokuzen Hidari,Minosuke Yamada,Kamatari Fujiwara,Makoto Kobori,Nobuo Nakamura,Atsushi Watanabe,Isao Kimura,Masao Shimizu,Yûnosuke Itô,Kumeko Urabe,Eiko Miyoshi,Noriko Honma","Drama,Back to top",A bureaucrat tries to find meaning in his life after he discovers he has terminal cancer.,Not Rated,Japan
Amélie,2001,8.3,"2,h, ,2,m","Audrey Tautou,Mathieu Kassovitz,Rufus,Lorella Cravotta,Serge Merlin,Jamel Debbouze,Clotilde Mollet,Claire Maurier,Isabelle Nanty,Dominique Pinon,Artus de Penguern,Yolande Moreau,Urbain Cancelier,Maurice Bénichou,Michel Robin,Andrée Damant,Claude Perron,Armelle","Comedy,Romance,Back to top","Amélie is an innocent and naive girl in Paris with her own sense of justice. She decides to help those around her and, along the way, discovers love.",R,France
The Apartment,1960,8.3,"2,h, ,5,m","Jack Lemmon,Shirley MacLaine,Fred MacMurray,Ray Walston,Jack Kruschen,David Lewis,Hope Holiday,Joan Shawlee,Naomi Stevens,Johnny Seven,Joyce Jameson,Willard Waterman,David White,Edie Adams,Dorothy Abbott,Bill Baldwin,Paul Bradley,Benny Burt","Comedy,Drama,Romance,Back to top","A Manhattan insurance clerk tries to rise in his company by letting its executives use his apartment for trysts, but complications and a romance of his own ensue.",Approved,United States
Vertigo,1958,8.3,"2,h, ,8,m","James Stewart,Kim Novak,Barbara Bel Geddes,Tom Helmore,Henry Jones,Raymond Bailey,Ellen Corby,Konstantin Shayne,Lee Patrick,David Ahdar,Isabel Analla,Jack Ano,Margaret Bacon,John Benson,Danny Borzage,Margaret Brayton,Paul Bryar,Boyd Cabeen","Mystery,Romance,Thriller,Back to top","A former San Francisco police detective juggles wrestling with his personal demons and becoming obsessed with the hauntingly beautiful woman he has been hired to trail, who may be deeply disturbed.",PG,United States
A Clockwork Orange,1971,8.3,"2,h, ,16,m","Malcolm McDowell,Patrick Magee,Michael Bates,Warren Clarke,John Clive,Adrienne Corri,Carl Duering,Paul Farrell,Clive Francis,Michael Gover,Miriam Karlin,James Marcus,Aubrey Morris,Godfrey Quigley,Sheila Raynor,Madge Ryan,John Savident,Anthony Sharp","Crime,Sci-Fi,Back to top","In the future, a sadistic gang leader is imprisoned and volunteers for a conduct-aversion experiment, but it doesn't go as planned.",X,United Kingdom
North by Northwest,1959,8.3,"2,h, ,16,m","Cary Grant,Eva Marie Saint,James Mason,Jessie Royce Landis,Leo G. Carroll,Josephine Hutchinson,Philip Ober,Martin Landau,Adam Williams,Edward Platt,Robert Ellenstein,Les Tremayne,Philip Coolidge,Patrick McVey,Edward Binns,Ken Lynch,Stanley Adams,John Alban","Action,Adventure,Mystery,Back to top","A New York City advertising executive goes on the run after being mistaken for a government agent by a group of foreign spies, and falls for a woman whose loyalties he begins to doubt.",Approved,United States
Lawrence of Arabia,1962,8.3,"3,h, ,38,m","Peter O'Toole,Alec Guinness,Anthony Quinn,Jack Hawkins,Omar Sharif,José Ferrer,Anthony Quayle,Claude Rains,Arthur Kennedy,Donald Wolfit,I.S. Johar,Gamil Ratib,Michel Ray,John Dimech,Zia Mohyeddin,Howard Marion-Crawford,Jack Gwillim,Hugh Miller","Adventure,Biography,Drama,Back to top","The story of T.E. Lawrence, the English officer who successfully united and led the diverse, often warring, Arab tribes during World War I in order to fight the Turks.",Approved,United Kingdom
M,1931,8.3,"1,h, ,39,m","Peter Lorre,Ellen Widmann,Inge Landgut,Otto Wernicke,Theodor Loos,Gustaf Gründgens,Friedrich Gnaß,Fritz Odemar,Paul Kemp,Theo Lingen,Rudolf Blümner,Georg John,Franz Stein,Ernst Stahl-Nachbaur,Gerhard Bienert,Karl Platen,Rosa Valetti,Hertha von Walther","Crime,Mystery,Thriller,Back to top","When the police in a German city are unable to catch a child-murderer, other criminals join in the manhunt.",Passed,Germany
Citizen Kane,1941,8.3,"1,h, ,59,m","Orson Welles,Joseph Cotten,Dorothy Comingore,Agnes Moorehead,Ruth Warrick,Ray Collins,Erskine Sanford,Everett Sloane,William Alland,Paul Stewart,George Coulouris,Fortunio Bonanova,Gus Schilling,Philip Van Zandt,Georgia Backus,Harry Shannon,Sonny Bupp,Buddy Swan","Drama,Mystery,Back to top","Following the death of publishing tycoon Charles Foster Kane, reporters scramble to uncover the meaning of his final utterance: 'Rosebud.'",PG,United States
The Hunt,2012,8.3,"1,h, ,55,m","Mads Mikkelsen,Thomas Bo Larsen,Annika Wedderkopp,Lasse Fogelstrøm,Susse Wold,Anne Louise Hassing,Lars Ranthe,Alexandra Rapaport,Sebastian Bull,Steen Ordell Guldbrand Jensen,Daniel Engstrup,Troels Thorsen,Søren Rønholt,Hana Shuan,Jytte Kvinesdal,Josefine Gråbøl,Bjarne Henriksen,Nicolai Dahl Hamilton","Drama,Back to top","A teacher lives a lonely life, all the while struggling over his son's custody. His life slowly gets better as he finds love and receives good news from his son, but his new luck is about to be brutally shattered by an innocent little lie.",R,Denmark
Come and See,1985,8.4,"2,h, ,22,m","Aleksey Kravchenko,Olga Mironova,Liubomiras Laucevicius,Vladas Bagdonas,Jüri Lumiste,Viktors Lorencs,Kazimir Rabetsky,Evgeniy Tilicheev,G. Velts,V. Vasilyev,Aleksandr Berda,Vasiliy Domrachyov,Nina Evdokimova,Igor Gnevashev,Adolf Hitler,Valery Kravchenko,Evgeniy Kryzhanovskiy,N. Lisichenok","Drama,Thriller,War,Back to top","After finding an old rifle, a young boy joins the Soviet resistance movement against ruthless German forces and experiences the horrors of World War II.",Not Rated,Soviet Union
Reservoir Dogs,1992,8.3,"1,h, ,39,m","Harvey Keitel,Tim Roth,Michael Madsen,Chris Penn,Steve Buscemi,Lawrence Tierney,Randy Brooks,Kirk Baltz,Edward Bunker,Quentin Tarantino,Rich Turner,David Steen,Tony Cosmo,Stevo Polyi,Michael Sottile,Robert Ruth,Lawrence Bender,Linda Kaye","Crime,Thriller,Back to top","When a simple jewelry heist goes horribly wrong, the surviving criminals begin to suspect that one of them is a police informant.",R,United States
Eternal Sunshine of the Spotless Mind,2004,8.3,"1,h, ,48,m","Jim Carrey,Kate Winslet,Tom Wilkinson,Gerry Robert Byrne,Elijah Wood,Thomas Jay Ryan,Mark Ruffalo,Jane Adams,David Cross,Kirsten Dunst,Ryan Whitney,Debbon Ayer,Amir Ali Said,Brian Price,Paulie Litt,Josh Flitter,Lola Daehler,Deirdre O'Connell","Drama,Romance,Sci-Fi,Back to top","When their relationship turns sour, a couple undergoes a medical procedure to have each other erased from their memories for ever.",R,United States
Star Wars: Episode VI - Return of the Jedi,1983,8.3,"2,h, ,11,m","Mark Hamill,Harrison Ford,Carrie Fisher,Billy Dee Williams,Anthony Daniels,Peter Mayhew,Sebastian Shaw,Ian McDiarmid,Frank Oz,James Earl Jones,David Prowse,Alec Guinness,Kenny Baker,Michael Pennington,Kenneth Colley,Michael Carter,Denis Lawson,Tim Rose","Action,Adventure,Fantasy,Back to top","After a daring mission to rescue Han Solo from Jabba the Hutt, the Rebels dispatch to Endor to destroy the second Death Star. Meanwhile, Luke struggles to help Darth Vader back from the dark side without falling into the Emperor's trap.",PG,United States
Capernaum,2018,8.4,"2,h, ,6,m","Zain Al Rafeea,Yordanos Shiferaw,Boluwatife Treasure Bankole,Kawsar Al Haddad,Fadi Yousef,Cedra Izzam,Alaa Chouchnieh,Elias Khoury,Mohammad Al Abdallah,Mohamad Abdellatif,Abdo Abdo,Hampig Abraham,Jamil Ahmad,Mohamad Akkar,Elias Akobegia,Riman Al Rafeea,Legamett Alamou,Majd Nabil Alhalabi","Drama,Back to top","While serving a five-year sentence for a violent crime, a 12-year-old boy sues his parents for neglect.",R,Lebanon
High and Low,1963,8.4,"2,h, ,23,m","Toshirô Mifune,Yutaka Sada,Tatsuya Nakadai,Kyôko Kagawa,Tatsuya Mihashi,Isao Kimura,Kenjirô Ishiyama,Takeshi Katô,Takashi Shimura,Jun Tazaki,Nobuo Nakamura,Yûnosuke Itô,Tsutomu Yamazaki,Minoru Chiaki,Eijirô Tôno,Masao Shimizu,Masahiko Shimazu,Toshio Egi","Crime,Drama,Mystery,Back to top",An executive of a Yokohama shoe company becomes a victim of extortion when his chauffeur's son is kidnapped by mistake and held for ransom.,Not Rated,Japan
Toy Story 3,2010,8.3,"1,h, ,43,m","Tom Hanks,Tim Allen,Joan Cusack,Ned Beatty,Don Rickles,Michael Keaton,Wallace Shawn,John Ratzenberger,Estelle Harris,John Morris,Jodi Benson,Emily Ricks Hahn,Laurie Metcalf,Blake Clark,Teddy Newton,Bud Luckey,Bea Miller,Javier Fernández-Peña","Animation,Adventure,Comedy,Back to top","The toys are mistakenly delivered to a day-care center instead of the attic right before Andy leaves for college, and it's up to Woody to convince the other toys that they weren't abandoned and to return home.",G,United States
2001: A Space Odyssey,1968,8.3,"2,h, ,29,m","Keir Dullea,Gary Lockwood,William Sylvester,Daniel Richter,Leonard Rossiter,Margaret Tyzack,Robert Beatty,Sean Sullivan,Douglas Rain,Frank Miller,Bill Weston,Ed Bishop,Glenn Beck,Alan Gifford,Ann Gillis,Edwina Carroll,Penny Brahms,Heather Downham","Adventure,Sci-Fi,Back to top","After uncovering a mysterious artifact buried beneath the Lunar surface, a spacecraft is sent to Jupiter to find its origins - a spacecraft manned by two men and the supercomputer H.A.L. 9000.",G,United Kingdom
Requiem for a Dream,2000,8.3,"1,h, ,42,m","Ellen Burstyn,Jared Leto,Jennifer Connelly,Marlon Wayans,Christopher McDonald,Louise Lasser,Marcia Jean Kurtz,Janet Sarno,Suzanne Shepherd,Joanne Gordon,Charlotte Aronofsky,Mark Margolis,Michael Kaycheck,Jack O'Connell,Chas Mastin,Ajay Naidu,Sean Gullette,Samia Shoaib","Drama,Back to top",The drug-induced utopias of four Coney Island people are shattered when their addictions run deep.,Unrated,United States
Singin' in the Rain,1952,8.3,"1,h, ,43,m","Gene Kelly,Donald O'Connor,Debbie Reynolds,Jean Hagen,Millard Mitchell,Cyd Charisse,Douglas Fowley,Rita Moreno,Dawn Addams,John Albright,Betty Allen,Sue Allen,John Angelo,Marie Ardell,Bette Arlen,David Bair,Lynn Bari,Jimmy Bates","Comedy,Musical,Romance,Back to top",A silent film star falls for a chorus girl just as he and his delusionally jealous screen partner are trying to make the difficult transition to talking pictures in 1920s Hollywood.,G,United States
3 Idiots,2009,8.4,"2,h, ,50,m","Aamir Khan,Madhavan,Mona Singh,Sharman Joshi,Kareena Kapoor,Boman Irani,Omi Vaidya,Olivier Lafont,Rahul Kumar,Parikshit Sahni,Farida Dadi,Amardeep Jha,Mukund Bhatt,Chaitali Bose,Jaaved Jaaferi,Jayant Kripalani,Arun Bali,Shoaib Ahmed","Comedy,Drama,Back to top","Two friends are searching for their long lost companion. They revisit their college days and recall the memories of their friend who inspired them to think differently, even as the rest of the world called them ""idiots"".",PG-13,India
Your Name.,2016,8.4,"1,h, ,46,m","Ryûnosuke Kamiki,Mone Kamishiraishi,Ryô Narita,Aoi Yûki,Nobunaga Shimazaki,Kaito Ishikawa,Kanon Tani,Masaki Terasoma,Sayaka Ôhara,Kazuhiko Inoue,Chafûrin,Kana Hanazawa,Yuka Terasaki,Takashi Onozuka,Yôhei Namekawa,Miyu Tsuji,Shin'ya Hamazoe,Kanami Satô","Animation,Drama,Fantasy,Back to top","Two strangers find themselves linked in a bizarre way. When a connection forms, will distance be the only thing to keep them apart?",TV-PG,Japan
Good Will Hunting,1997,8.3,"2,h, ,6,m","Robin Williams,Matt Damon,Ben Affleck,Stellan Skarsgård,John Mighton,Rachel Majorowski,Colleen McCauley,Casey Affleck,Cole Hauser,Matt Mercier,Ralph St. George,Rob Lynds,Dan Washington,Alison Folland,Derrick Bridgeman,Vik Sahay,Shannon Egleson,Rob Lyons","Drama,Romance,Back to top","Will Hunting, a janitor at M.I.T., has a gift for mathematics, but needs help from a psychologist to find direction in his life.",R,United States
Once Upon a Time in America,1984,8.3,"3,h, ,49,m","Robert De Niro,James Woods,Elizabeth McGovern,Treat Williams,Tuesday Weld,Burt Young,Joe Pesci,Danny Aiello,William Forsythe,James Hayden,Darlanne Fluegel,Larry Rapp,Dutch Miller,Robert Harper,Richard Bright,Gerard Murphy,Amy Ryder,Olga Karlatos","Crime,Drama,Back to top","A former Prohibition-era Jewish gangster returns to the Lower East Side of Manhattan 35 years later, where he must once again confront the ghosts and regrets of his old life.",R,Italy
Princess Mononoke,1997,8.4,"2,h, ,14,m","Yôji Matsuda,Yuriko Ishida,Yûko Tanaka,Billy Crudup,Billy Bob Thornton,Minnie Driver,John DiMaggio,Claire Danes,John DeMita,Jada Pinkett Smith,Gillian Anderson,Keith David,Corey Burton,Tara Strong,Julia Fletcher,Debi Derryberry,Alex Fernandez,Jack Fletcher","Animation,Action,Adventure,Back to top","On a journey to find the cure for a Tatarigami's curse, Ashitaka finds himself in the middle of a war between the forest gods and Tatara, a mining colony. In this quest he also meets San, the Mononoke Hime.",PG-13,Japan
Top Gun: Maverick,2022,8.4,"2,h, ,10,m","Tom Cruise,Jennifer Connelly,Miles Teller,Val Kilmer,Bashir Salahuddin,Jon Hamm,Charles Parnell,Monica Barbaro,Lewis Pullman,Jay Ellis,Danny Ramirez,Glen Powell,Jack Schumacher,Manny Jacinto,Kara Wang,Greg Tarzan Davis,Jake Picking,Raymond Lee","Action,Drama,Back to top","After thirty years, Maverick is still pushing the envelope as a top naval aviator, but must confront ghosts of his past when he leads TOP GUN's elite graduates on a mission that demands the ultimate sacrifice from those chosen to fly it.",PG-13,United States
Braveheart,1995,8.4,"2,h, ,58,m","Mel Gibson,Sophie Marceau,Patrick McGoohan,Angus Macfadyen,James Robinson,Sean Lawlor,Sandy Nelson,James Cosmo,Sean McGinley,Alan Tall,Andrew Weir,Gerda Stevenson,Ralph Riach,Mhairi Calvey,Brian Cox,Peter Hanly,Stephen Billington,Barry McGovern","Biography,Drama,History,Back to top",Scottish warrior William Wallace leads his countrymen in a rebellion to free his homeland from the tyranny of King Edward I of England.,R,United States
Avengers: Endgame,2019,8.4,"3,h, ,1,m","Robert Downey Jr.,Chris Evans,Mark Ruffalo,Chris Hemsworth,Scarlett Johansson,Jeremy Renner,Don Cheadle,Paul Rudd,Benedict Cumberbatch,Chadwick Boseman,Brie Larson,Tom Holland,Karen Gillan,Zoe Saldana,Evangeline Lilly,Tessa Thompson,Rene Russo,Elizabeth Olsen","Action,Adventure,Drama,Back to top","After the devastating events of Avengers: Infinity War (2018), the universe is in ruins. With the help of remaining allies, the Avengers assemble once more in order to reverse Thanos' actions and restore balance to the universe.",PG-13,United States
Toy Story,1995,8.3,"1,h, ,21,m","Tom Hanks,Tim Allen,Don Rickles,Jim Varney,Wallace Shawn,John Ratzenberger,Annie Potts,John Morris,Erik von Detten,Laurie Metcalf,R. Lee Ermey,Sarah Rayne,Penn Jillette,Jack Angel,Spencer Aste,Greg Berg,Lisa Bradley,Kendall Cunningham","Animation,Adventure,Comedy,Back to top",A cowboy doll is profoundly threatened and jealous when a new spaceman action figure supplants him as top toy in a boy's bedroom.,G,United States
Coco,2017,8.4,"1,h, ,45,m","Anthony Gonzalez,Gael García Bernal,Benjamin Bratt,Alanna Ubach,Renee Victor,Jaime Camil,Alfonso Arau,Herbert Siguenza,Gabriel Iglesias,Lombardo Boyar,Ana Ofelia Murguía,Natalia Cordova-Buckley,Selene Luna,Edward James Olmos,Sofía Espinosa,Carla Medina,Dyana Ortelli,Luis Valdez","Animation,Adventure,Comedy,Back to top","Aspiring musician Miguel, confronted with his family's ancestral ban on music, enters the Land of the Dead to find his great-great-grandfather, a legendary singer.",PG,United States
Inglourious Basterds,2009,8.3,"2,h, ,33,m","Brad Pitt,Diane Kruger,Eli Roth,Mélanie Laurent,Christoph Waltz,Michael Fassbender,Daniel Brühl,Til Schweiger,Gedeon Burkhard,Jacky Ido,B.J. Novak,Omar Doom,August Diehl,Denis Ménochet,Sylvester Groth,Martin Wuttke,Mike Myers,Julie Dreyfus","Adventure,Drama,War,Back to top","In Nazi-occupied France during World War II, a plan to assassinate Nazi leaders by a group of Jewish U.S. soldiers coincides with a theatre owner's vengeful plans for the same.",R,Germany
Oldboy,2003,8.4,"2,h","Choi Min-sik,Yoo Ji-tae,Kang Hye-jeong,Kim Byeong-Ok,Dae-han Ji,Dal-su Oh,Seung-shin Lee,Jin-Seo Yoon,Tae-kyung Oh,Yoo Yeon-Seok,Il-han Oo,Young-hee Lee,Young-ae Kim,Mi Mi Lee,Jae-Duk Han,Jung Ae Kwak,San Kim,Chae-soo Jang","Action,Drama,Mystery,Back to top","After being kidnapped and imprisoned for fifteen years, Oh Dae-Su is released, only to find that he must find his captor in five days.",R,South Korea
Joker,2019,8.4,"2,h, ,2,m","Joaquin Phoenix,Robert De Niro,Zazie Beetz,Frances Conroy,Brett Cullen,Shea Whigham,Bill Camp,Glenn Fleshler,Leigh Gill,Josh Pais,Rocco Luna,Marc Maron,Sondra James,Murphy Guyer,Douglas Hodge,Dante Pereira-Olson,Carrie Louise Putrello,Sharon Washington","Crime,Drama,Thriller,Back to top",A mentally troubled stand-up comedian embarks on a downward spiral that leads to the creation of an iconic villain.,R,United States
Amadeus,1984,8.4,"2,h, ,40,m","F. Murray Abraham,Tom Hulce,Elizabeth Berridge,Roy Dotrice,Simon Callow,Christine Ebersole,Jeffrey Jones,Charles Kay,Kenneth McMillan,Kenny Baker,Lisbeth Bartlett,Barbara Bryne,Martin Cavina,Roderick Cook,Milan Demjanenko,Peter DiGesu,Richard Frank,Patrick Hines","Biography,Drama,Music,Back to top","The life, success and troubles of Wolfgang Amadeus Mozart, as told by Antonio Salieri, the contemporaneous composer who was deeply jealous of Mozart's talent and claimed to have murdered him.",PG,United States
Dr. Strangelove or: How I Learned to Stop Worrying and Love the Bomb,1964,8.4,"1,h, ,35,m","Peter Sellers,George C. Scott,Sterling Hayden,Keenan Wynn,Slim Pickens,Peter Bull,James Earl Jones,Tracy Reed,Jack Creley,Frank Berry,Robert O'Neil,Glenn Beck,Roy Stephens,Shane Rimmer,Hal Galili,Paul Tamarin,Laurence Herder,Gordon Tanner","Comedy,War,Back to top","An insane American general orders a bombing attack on the Soviet Union, triggering a path to nuclear holocaust that a war room full of politicians and generals frantically tries to stop.",PG,United Kingdom
American Beauty,1999,8.4,"2,h, ,2,m","Kevin Spacey,Annette Bening,Thora Birch,Wes Bentley,Mena Suvari,Peter Gallagher,Allison Janney,Chris Cooper,Scott Bakula,Sam Robards,Barry Del Sherman,Ara Celi,John Cho,Fort Atkinson,Sue Casey,Kent Faulcon,Brenda Wehle,Lisa Cloud","Drama,Back to top",A sexually frustrated suburban father has a mid-life crisis after becoming infatuated with his daughter's best friend.,R,United States
Spider-Man: Into the Spider-Verse,2018,8.4,"1,h, ,57,m","Shameik Moore,Jake Johnson,Hailee Steinfeld,Mahershala Ali,Brian Tyree Henry,Lily Tomlin,Luna Lauren Velez,Zoë Kravitz,John Mulaney,Kimiko Glenn,Nicolas Cage,Kathryn Hahn,Liev Schreiber,Chris Pine,Natalie Morales,Edwin R. Habacon,Oscar Isaac,Greta Lee","Animation,Action,Adventure,Back to top","Teen Miles Morales becomes the Spider-Man of his universe, and must join with five spider-powered individuals from other dimensions to stop a threat for all realities.",PG,United States
Aliens,1986,8.4,"2,h, ,17,m","Sigourney Weaver,Michael Biehn,Carrie Henn,Paul Reiser,Lance Henriksen,Bill Paxton,William Hope,Jenette Goldstein,Al Matthews,Mark Rolston,Ricco Ross,Colette Hiller,Daniel Kash,Cynthia Dale Scott,Tip Tipping,Trevor Steedman,Paul Maxwell,Valerie Colgan","Action,Adventure,Sci-Fi,Back to top","Fifty-seven years after surviving an apocalyptic attack aboard her space vessel by merciless space creatures, Officer Ripley awakens from hyper-sleep and tries to warn anyone who will listen about the predators.",R,United Kingdom
Witness for the Prosecution,1957,8.4,"1,h, ,56,m","Tyrone Power,Marlene Dietrich,Charles Laughton,Elsa Lanchester,John Williams,Henry Daniell,Ian Wolfe,Torin Thatcher,Norma Varden,Una O'Connor,Francis Compton,Philip Tonge,Ruta Lee,Patrick Aherne,Don Ames,Walter Bacon,Eddie Baker,Benjie Bancroft","Crime,Drama,Mystery,Back to top",A veteran British barrister must defend his client in a murder trial that has surprise after surprise.,Approved,United States
The Great Dictator,1940,8.4,"2,h, ,5,m","Charles Chaplin,Paulette Goddard,Jack Oakie,Reginald Gardiner,Henry Daniell,Billy Gilbert,Grace Hayle,Carter DeHaven,Maurice Moscovitch,Emma Dunn,Bernard Gorcey,Paul Weigel,Chester Conklin,Esther Michelson,Hank Mann,Florence Wright,Eddie Gribbon,Rudolph Anders","Comedy,Drama,War,Back to top",Dictator Adenoid Hynkel tries to expand his empire while a poor Jewish barber tries to avoid persecution from Hynkel's regime.,G,United States
Paths of Glory,1957,8.4,"1,h, ,28,m","Kirk Douglas,Ralph Meeker,Adolphe Menjou,George Macready,Wayne Morris,Richard Anderson,Joe Turkel,Christiane Kubrick,Jerry Hausner,Peter Capell,Emile Meyer,Bert Freed,Kem Dibbs,Timothy Carey,Fred Bell,John Stein,Harold Benedict,Leon Briggs","Drama,War,Back to top","After refusing to attack an enemy position, a general accuses the soldiers of cowardice and their commanding officer must defend them.",Approved,United States
The Dark Knight Rises,2012,8.4,"2,h, ,44,m","Christian Bale,Tom Hardy,Anne Hathaway,Gary Oldman,Joseph Gordon-Levitt,Marion Cotillard,Morgan Freeman,Michael Caine,Matthew Modine,Alon Aboutboul,Ben Mendelsohn,Burn Gorman,Daniel Sunjata,Aidan Gillen,Sam Kennard,Aliash Tepina,Nestor Carbonell,Brett Cullen","Action,Drama,Back to top","Eight years after the Joker's reign of anarchy, Batman, with the help of the enigmatic Selina Kyle, is forced from his exile to save Gotham City from the brutal guerrilla terrorist Bane.",PG-13,United States
Avengers: Infinity War,2018,8.4,"2,h, ,29,m","Robert Downey Jr.,Chris Hemsworth,Mark Ruffalo,Chris Evans,Scarlett Johansson,Don Cheadle,Benedict Cumberbatch,Tom Holland,Chadwick Boseman,Zoe Saldana,Karen Gillan,Tom Hiddleston,Paul Bettany,Elizabeth Olsen,Anthony Mackie,Sebastian Stan,Idris Elba,Danai Gurira","Action,Adventure,Sci-Fi,Back to top",The Avengers and their allies must be willing to sacrifice all in an attempt to defeat the powerful Thanos before his blitz of devastation and ruin puts an end to the universe.,PG-13,United States
The Shining,1980,8.4,"2,h, ,26,m","Jack Nicholson,Shelley Duvall,Danny Lloyd,Scatman Crothers,Barry Nelson,Philip Stone,Joe Turkel,Anne Jackson,Tony Burton,Lia Beldam,Billie Gibson,Barry Dennen,David Baxt,Manning Redwood,Lisa Burns,Louise Burns,Robin Pappas,Alison Coleridge","Drama,Horror,Back to top","A family heads to an isolated hotel for the winter where a sinister presence influences the father into violence, while his psychic son sees horrific forebodings from both past and future.",R,United Kingdom
